,News Account,News Text,News Created Date,News id,News Account id,Retweet Count,Like Count,Followers Count,News Compound,News Positive,News Neutral,News Negative,News Tweets Ago
0,@FoxNews,".@kimguilfoyle: “@POTUS is the one that has the courage and the certainty and the fortitude to do the right thing, and take a strong stance, not just against Syria, but against Iran and against Russia.” #TheFive ",Apr 17,986134665135259648,1367531,8,41,17712647,0.5789,0.148,0.852,0.0,1
1,@FoxNews,Husband surprises terminally ill wife with proposal do-over ,Apr 17,986133407078998016,1367531,10,35,17712647,-0.2263,0.162,0.598,0.239,2
2,@FoxNews,.@Scaramucci on Syria: “He doesn’t want to have a problem in the area as much as he wants to eradicate the use of chemical warfare.” ,Apr 17,986132149039321088,1367531,49,72,17712647,-0.34,0.048,0.852,0.1,3
3,@FoxNews,Black naked Harvard student seen punched by police ,Apr 17,986130890475687936,1367531,25,42,17712647,0.0,0.0,1.0,0.0,4
4,@FoxNews,A Kentucky police officer helped a mother duck and her babies cross the road. ,Apr 17,986129634029854721,1367531,81,290,17712647,0.0,0.0,1.0,0.0,5
5,@FoxNews,"California rejects proposed border duties for troops, US says ",Apr 17,986128373544964096,1367531,36,60,17712647,-0.4939,0.0,0.738,0.262,6
6,@FoxNews,.@POTUS: “We have the biggest tax cut in history… The individual mandate is gone.” ,Apr 17,986127115488669697,1367531,59,191,17712647,-0.2732,0.0,0.87,0.13,7
7,@FoxNews,".@TomFitton: ""Mr. @Comey hates President @realDonaldTrump and he was willing to break the rules, and maybe the law, to get him."" ",Apr 17,986125857780531200,1367531,46,121,17712647,-0.4404,0.0,0.884,0.116,8
8,@FoxNews,".@CLewandowski_: “Both of the leaders of the @FBI, both Jim @Comey and Andrew McCabe have done some serious damage to what has been a historically very important institution.” ",Apr 17,986124598965100544,1367531,61,176,17712647,-0.3415,0.066,0.791,0.142,9
9,@FoxNews,"""If this were @HillaryClinton, [the @ACLU would be] raising money left and right, defending Hillary Clinton's right."" 

On ""Fox &amp; Friends,"" @AlanDersh slammed the ACLU, stating it is ""absolutely political."" ",Apr 17,986123341009506304,1367531,86,218,17712647,0.0,0.0,1.0,0.0,10
10,@FoxNews,".@carldemaio: “Sanctuary cities and sanctuary states are about whether we want to shield criminals, whether we want criminals re-released into our communities to commit more crimes. Who is for that? ” #TheStory ",Apr 17,986122083175489536,1367531,43,117,17712647,-0.6808,0.122,0.689,0.189,11
11,@FoxNews,"McDonald’s manager apologizes for slapping customer, says woman threw coffee at her first ",Apr 17,986120824640933888,1367531,39,108,17712647,0.3612,0.161,0.839,0.0,12
12,@FoxNews,".@PhilipWegmann: ""[President @realDonaldTrump] is also sending a clear, much larger message, which is the United States is not going to tolerate the proliferation of chemical weapons."" ",Apr 17,986119565678559232,1367531,30,107,17712647,0.6597,0.178,0.822,0.0,13
13,@FoxNews,"ACMs: Miranda Lambert shares 'broken heart' at first awards show with ex Blake Shelton, Gwen Stefani ",Apr 17,986118308368994305,1367531,14,72,17712647,0.2732,0.233,0.628,0.139,14
14,@FoxNews,"Terry Turchie: ""James @Comey's higher loyalty is to his wallet at this point."" @IngrahamAngle ",Apr 17,986117049037406209,1367531,69,175,17712647,0.5423,0.189,0.811,0.0,15
15,@FoxNews,Binghamton University student charged in the ‘targeted’ stabbing death of freshman ,Apr 17,986115790947717120,1367531,39,66,17712647,-0.6908,0.0,0.637,0.363,16
16,@FoxNews,".@jkirchick: “There’s international law among civilized people and nations that chemical weapons should not be used in warfare…@POTUS drew that line in the sand that you’ll remember Barack #Obama drew, but didn’t actually enforce. @POTUS actually enforced it.” #Tucker ",Apr 17,986114533323292672,1367531,48,164,17712647,-0.2382,0.0,0.952,0.048,17
17,@FoxNews,"Southwest passengers 'crying,' 'screaming,'  preparing 'to die' in attempted landing during storm ",Apr 17,986113274012827650,1367531,50,68,17712647,-0.5994,0.0,0.755,0.245,18
18,@FoxNews,"Retired @FBI special agent Bobby Chacon: ""[@Comey] took the low road and he's dragging the men and women of the FBI back into this political maelstrom that they don't deserve...He put them there in the first place."" @IngrahamAngle ",Apr 17,986112016057171968,1367531,108,204,17712647,0.1531,0.063,0.888,0.049,19
19,@FoxNews,Body of last missing family member found in California river ,Apr 17,986110757602578432,1367531,29,62,17712647,-0.296,0.0,0.82,0.18,20
20,@FoxNews,.@POTUS: “We’re doing tremendously. Companies are moving back into our country.” ,Apr 17,986109499105722368,1367531,142,456,17712647,0.0,0.0,1.0,0.0,21
21,@FoxNews,"Mia Polaski and her husband Ryan Polaski kiss while clearing debris from her father’s storm-damaged home in Elon, Virginia. The governor of Virginia has declared a state of emergency after storms barreled through parts of western Virginia. ",Apr 17,986108242064527360,1367531,45,149,17712647,-0.25,0.067,0.817,0.115,22
22,@FoxNews,".@AlanDersh on the ACLU: “It is a partisan, hard-left, political organization that no longer cares about the civil liberties of all Americans. It is agenda-driven, money-driven and anti-Trump.” ",Apr 17,986106985320931328,1367531,141,349,17712647,0.6249,0.188,0.746,0.066,23
23,@FoxNews,'A Man Without Courage': @AlanDersh Slams Comey for Leaking Trump Memos ,Apr 17,986105724529852416,1367531,104,277,17712647,0.0,0.0,1.0,0.0,24
24,@FoxNews,".@KatiePavlich: ""People are looking at their paychecks now and going, 'Yeah, I have more money now, I'm pretty sure I'm liking what the Republicans are doing.'"" @IngrahamAngle ",Apr 17,986104466666598400,1367531,124,383,17712647,0.802,0.255,0.745,0.0,25
25,@FoxNews,More California cities may join fight against state’s pro-illegal immigrant policies ,Apr 17,986103207821688832,1367531,237,784,17712647,-0.1027,0.149,0.676,0.176,26
26,@FoxNews,Dog and Deer Have Unexpected Morning Playdate ,Apr 17,986101959538237440,1367531,169,602,17712647,0.0,0.0,1.0,0.0,27
27,@FoxNews,.@KarlRove: “@Comey’s entire story continues to fall apart…It’s mystifying how he sanctimoniously stands up there and suggests that he’s done this all with a great concern for ethics and the truth when he really is being driven by personal considerations…” #TheStory ,Apr 17,986099433040416768,1367531,129,370,17712647,0.7506,0.141,0.859,0.0,28
28,@FoxNews,South Carolina prison riot leaves several dead; witness says he saw bodies stacked on top of each other ,Apr 17,986098175130963968,1367531,77,109,17712647,-0.886,0.064,0.536,0.4,29
29,@FoxNews,".@JesseBWatters: “If you have the central witness in an obstruction case out there doing a nationwide tour, confessing, admitting to being biased…how does that jive with a fair and balanced criminal investigation in this case?” #TheFive ",Apr 17,986096917443641345,1367531,223,710,17712647,-0.2732,0.059,0.853,0.088,30
30,@FoxNews,"""It is now quite evident that James Comey’s higher loyalty is to James Comey, and James Comey alone.""

Chris Swecker, who served 24 years in the @FBI as a special agent, called James @Comey's actions ""unworthy "" of the FBI. ",Apr 17,986095658279944192,1367531,173,497,17712647,0.4939,0.134,0.801,0.065,31
31,@FoxNews,".@POTUS: “Tomorrow is tax day… and remember this, this is the last time you’re going to fill out the long, complicated, horrible return.” ",Apr 17,986094399884054530,1367531,393,1414,17712647,-0.5423,0.0,0.868,0.132,32
32,@FoxNews,"FEC hit with lawsuit over ignoring civil complaint accusing #Clinton, @DNC in election scheme ",Apr 17,986093141827735552,1367531,256,614,17712647,-0.7579,0.0,0.564,0.436,33
33,@FoxNews,.@AlanDersh on James @Comey: “This is a man without courage.” ,Apr 17,986092135534374912,1367531,137,503,17712647,0.0,0.0,1.0,0.0,34
34,@FoxNews,Billionaire banking heir Matthew Mellon dies in rehab facility ,Apr 17,986090654915850241,1367531,87,113,17712647,0.0,0.0,1.0,0.0,35
35,@FoxNews,".@kimguilfoyle: “@POTUS is the one that has the courage and the certainty and the fortitude to do the right thing, and take a strong stance, not just against Syria, but against Iran and against Russia.” #TheFive ",Apr 17,986087708136300545,1367531,266,965,17712647,0.5789,0.148,0.852,0.0,36
36,@FoxNews,"On Monday, @POTUS hosted a roundtable discussion touting Republican tax reform law, saying America is ""open for business."" ",Apr 17,986084431617282048,1367531,150,600,17712647,-0.1779,0.0,0.914,0.086,37
37,@FoxNews,A Kentucky police officer helped a mother duck and her babies cross the road ,Apr 17,986080765699125249,1367531,406,1752,17712647,0.0,0.0,1.0,0.0,38
38,@FoxNews,".@KatiePavlich: ""People are looking at their paychecks now and going, 'Yeah, I have more money now, I'm pretty sure I'm liking what the Republicans are doing.'"" @IngrahamAngle ",Apr 17,986077070005559296,1367531,568,2000,17712647,0.802,0.255,0.745,0.0,39
39,@FoxNews,"Garland Nixon: ""By the time it gets to the midterms, it's going to be all about excitement, and @TheDemocrats have the excitement on their side."" @IngrahamAngle ",Apr 17,986075753056960512,1367531,28,79,17712647,0.7506,0.204,0.796,0.0,40
40,@FoxNews,"Retired @FBI special agent Bobby Chacon: ""[@Comey] took the low road and he's dragging the men and women of the FBI back into this political maelstrom that they don't deserve...He put them there in the first place."" @IngrahamAngle ",Apr 17,986072589641699328,1367531,412,906,17712647,0.1531,0.063,0.888,0.049,41
41,@FoxNews,"Terry Turchie: ""James @Comey's higher loyalty is to his wallet at this point."" @IngrahamAngle ",Apr 17,986070616213204993,1367531,228,699,17712647,0.5423,0.189,0.811,0.0,42
42,@FoxNews,Justice Dept IG Horowitz predicts Clinton email report will be out in May ,Apr 17,986069311470096389,1367531,602,1483,17712647,0.5267,0.207,0.793,0.0,43
43,@FoxNews,"Rod Blagojevich's Wife Asks #Trump For Pardon, Rips SCOTUS Appeal Rejection ",Apr 17,986068858904743937,1367531,76,158,17712647,-0.296,0.146,0.633,0.222,44
44,@FoxNews,"Russia, Syria block inspectors from chemical weapons attack site, watchdog says ",Apr 17,986064322567651328,1367531,275,352,17712647,-0.836,0.0,0.503,0.497,45
45,@FoxNews,"Dog 'arrested' for being a bad boy, picking fights with deer ",Apr 17,986061666960990209,1367531,182,584,17712647,-0.7351,0.0,0.592,0.408,46
46,@FoxNews,Sacramento police release dozens more videos from Stephon Clark shooting ,Apr 17,986059524141453312,1367531,43,82,17712647,0.0,0.0,1.0,0.0,47
47,@FoxNews,San Diego Votes on Rejecting Jerry Brown's Sanctuary State Policy ,Apr 17,986055831446794240,1367531,663,2370,17712647,-0.4588,0.0,0.769,0.231,48
48,@FoxNews,Israel destroys Hamas' 'longest and deepest' border tunnel yet ,Apr 17,986053908089929728,1367531,433,1478,17712647,-0.5574,0.0,0.714,0.286,49
49,@FoxNews,".@AlanDersh on the ACLU: “It is a partisan, hard-left, political organization that no longer cares about the civil liberties of all Americans. It is agenda-driven, money-driven and anti-Trump.” ",Apr 17,986048882152001536,1367531,1917,4924,17712647,0.6249,0.188,0.746,0.066,50
50,@FoxNews,White House backs away from Haley's pledge of new sanctions against Russia ,Apr 17,986044068085026816,1367531,107,215,17712647,-0.0516,0.0,0.909,0.091,51
51,@FoxNews,".@jkirchick: “There’s international law among civilized people &amp; nations that chemical weapons should not be used in warfare…@POTUS drew that line in the sand that you’ll remember Barack Obama drew, but didn’t actually enforce. @POTUS actually enforced it.” #Tucker ",Apr 17,986042551458320384,1367531,225,791,17712647,-0.2382,0.0,0.952,0.048,52
52,@FoxNews,"OPINION: @Comey's actions are ‘unworthy’ of the @FBI, says former Assistant Director and 24-year veteran agent ",Apr 17,986040360861302784,1367531,1014,3303,17712647,0.0,0.0,1.0,0.0,53
53,@FoxNews,Pentagon denies US attacked Syrian air base outside Homs ,Apr 17,986037022195421184,1367531,108,242,17712647,-0.7003,0.0,0.58,0.42,54
54,@FoxNews,Protesters march to various Starbucks cafes in Philadelphia following controversial arrests ,Apr 17,986034757149446144,1367531,91,272,17712647,-0.6808,0.0,0.577,0.423,55
55,@FoxNews,".@carldemaio: “What we need to do is focus our efforts on getting criminals off the street, and getting them deported so that they cannot commit more crimes.” #TheStory ",Apr 17,986032995688763392,1367531,165,580,17712647,-0.6796,0.0,0.829,0.171,56
56,@FoxNews,".@carldemaio: “Sanctuary cities and sanctuary states are about whether we want to shield criminals, whether we want criminals re-released into our communities to commit more crimes. Who is for that? ” #TheStory ",Apr 16,986031093538320390,1367531,163,445,17712647,-0.6808,0.122,0.689,0.189,57
57,@FoxNews,.@ScottWalker: “When I talk to people around the state of Wisconsin…they want to hear more about how the tax cuts are going to benefit them and their family.” #TheStory ,Apr 16,986030144035917825,1367531,138,472,17712647,0.2732,0.132,0.8,0.068,58
58,@FoxNews,"Texas man gets life in prison for allegedly killing college student after her charred, dismembered body found in kiddie pool ",Apr 16,986027115744256006,1367531,121,296,17712647,-0.8271,0.0,0.712,0.288,59
59,@FoxNews,.@KarlRove: “@Comey’s entire story continues to fall apart…It’s mystifying how he sanctimoniously stands up there and suggests that he’s done this all with a great concern for ethics and the truth when he really is being driven by personal considerations…” #TheStory ,Apr 16,986024115088908288,1367531,638,1804,17712647,0.7506,0.141,0.859,0.0,60
60,@FoxNews,'Night Court' star Harry Anderson dead at 65 ,Apr 16,986023048875790342,1367531,304,502,17712647,-0.6486,0.0,0.65,0.35,61
61,@FoxNews,"WATCH: Spike, a service dog-in-training, learns the ropes of working at Fox News from his new friend. @dailybriefing #TheDailySpike ",Apr 16,986020122883248129,1367531,135,661,17712647,0.4939,0.144,0.856,0.0,62
62,@FoxNews,California in dispute over #Trump administration plan for National Guard troops at border ,Apr 16,986018903179620357,1367531,70,141,17712647,-0.4019,0.0,0.828,0.172,63
63,@FoxNews,"Scott Pruitt's chief of staff approved controversial raises for aides, @EPA watchdog finds ",Apr 16,986017141882281984,1367531,69,104,17712647,0.25,0.169,0.723,0.108,64
64,@FoxNews,"RT @MikeEmanuelFox: Republicans try to roll back Dodd-Frank rules: Senate passes bill, House wants to add more components. From #SpecialRep…",Apr 16,986015740443668482,1367531,52,0,17712647,0.0,0.0,1.0,0.0,65
65,@FoxNews,Fishermen reel in 'rare' 10-foot shark off Florida coast ,Apr 16,986015379443957760,1367531,239,542,17712647,0.0,0.0,1.0,0.0,66
66,@FoxNews,".@MZHemingway on @Comey: “His whole image that he wants to project is that he’s this honest Boy Scout. The book comes out, and it kind of paints a different image…” #SpecialReport ",Apr 16,986012944835194880,1367531,212,729,17712647,0.596,0.114,0.886,0.0,67
67,@FoxNews,"JUST IN: @SenJohnMcCain undergoes surgery for intestinal infection, now in stable condition ",Apr 16,986009347217088513,1367531,110,315,17712647,0.296,0.155,0.845,0.0,68
68,@FoxNews,Tax reform law is set to impact 2019 tax returns. @pdoocy reports. ,Apr 16,986008691366342656,1367531,88,259,17712647,0.0,0.0,1.0,0.0,69
69,@FoxNews,.@RandPaul: Do FBI agents Strzok and Page still have security clearances? The answer should alarm you ,Apr 16,986004701341724672,1367531,452,992,17712647,0.0,0.121,0.758,0.121,70
70,@FoxNews,Judge won't immediately rule on documents seized by @FBI in Michael Cohen raid ,Apr 16,986001632902156288,1367531,159,239,17712647,0.0,0.0,1.0,0.0,71
71,@FoxNews,Khloe Kardashian reveals baby name: True Thompson ,Apr 16,986000717570805762,1367531,38,290,17712647,0.4215,0.286,0.714,0.0,72
72,@FoxNews,.@ChrisChristie: @Comey 'Would Have Fired Me on the Spot' If I Did What He Did ,Apr 16,985998595987050497,1367531,229,794,17712647,-0.5574,0.0,0.795,0.205,73
73,@FoxNews,".@kimguilfoyle: “@POTUS is the one that has the courage and the certainty and the fortitude to do the right thing, and take a strong stance, not just against Syria, but against Iran and against Russia.” #TheFive ",Apr 16,985995913721237504,1367531,531,1806,17712647,0.5789,0.148,0.852,0.0,74
74,@FoxNews,"Frat brothers plead guilty, receive jail time in Florida State hazing death ",Apr 16,985994492124848129,1367531,132,330,17712647,-0.7717,0.0,0.621,0.379,75
75,@FoxNews,Flesh-eating ulcer 'epidemic' in Australia stumps doctors ,Apr 16,985992730093338624,1367531,183,143,17712647,0.0,0.0,1.0,0.0,76
76,@FoxNews,".@JesseBWatters: “If you have the central witness in an obstruction case out there doing a nationwide tour, confessing, admitting to being biased…how does that jive with a fair and balanced criminal investigation in this case?” #TheFive ",Apr 16,985989903581417473,1367531,1012,3363,17712647,-0.2732,0.059,0.853,0.088,77
77,@FoxNews,WATCH: US missile attack on Syria captured in stunning Pentagon video ,Apr 16,985986385038454784,1367531,323,940,17712647,-0.128,0.166,0.637,0.197,78
78,@FoxNews,Binghamton University cancels classes after second student murder in 5 weeks ,Apr 16,985985140366217216,1367531,225,197,17712647,-0.765,0.0,0.577,0.423,79
79,@FoxNews,New mom given months to live after finding cancerous lump on face during labor ,Apr 16,985981909615423490,1367531,72,201,17712647,0.0,0.0,1.0,0.0,80
80,@FoxNews,"Cohen attorneys fight feds over ‘unprecedented’ search, in hearing attended by Stormy Daniels - via @brookefoxnews 
",Apr 16,985981411109810177,1367531,181,661,17712647,-0.3818,0.0,0.852,0.148,81
81,@FoxNews,Motorcycle rider crashes and gets shot by his own gun ,Apr 16,985979884055998465,1367531,61,138,17712647,-0.34,0.0,0.806,0.194,82
82,@FoxNews,.@TheJusticeDept IG Horowitz predicts Clinton email report will be out in May ,Apr 16,985976476502757376,1367531,541,1384,17712647,0.0,0.0,1.0,0.0,83
83,@FoxNews,Lyrid meteor shower to put on spectacular show in April: What to know about the starry spectacle ,Apr 16,985972823788224512,1367531,119,276,17712647,0.0,0.0,1.0,0.0,84
84,@FoxNews,Husband surprises terminally ill wife with proposal do-over ,Apr 16,985966924608794624,1367531,146,754,17712647,-0.2263,0.162,0.598,0.239,85
85,@FoxNews,.@kendricklamar is the first rapper to win the Pulitzer Prize ,Apr 16,985963538295476224,1367531,134,396,17712647,0.7964,0.441,0.559,0.0,86
86,@FoxNews,California rejects #Trump administration plan for National Guard troops on border ,Apr 16,985961711629987846,1367531,220,423,17712647,-0.4939,0.0,0.775,0.225,87
87,@FoxNews,Asteroid the size of a football field makes 'surprise' flyby past Earth ,Apr 16,985958761675284481,1367531,325,653,17712647,0.0,0.0,1.0,0.0,88
88,@FoxNews,"R. Lee Ermey's most memorable roles, from 'Full Metal Jacket' to 'Toy Story'  ",Apr 16,985952983811854337,1367531,132,601,17712647,0.0,0.0,1.0,0.0,89
89,@FoxNews,"U.S., Britain, France signal return to diplomacy after strikes on Syria's chemical sites; @EricShawnTV reports, @dailybriefing ",Apr 16,985952640231202817,1367531,102,282,17712647,-0.3612,0.0,0.865,0.135,90
90,@FoxNews,5-year-old gets Transformers party to mark end of tumor treatment ,Apr 16,985951515801276418,1367531,96,676,17712647,0.0258,0.189,0.629,0.182,91
91,@FoxNews,"Anti-Trump American history textbook 'blatantly biased,' critics say (via @calebparke) ",Apr 16,985948786068475905,1367531,232,307,17712647,-0.296,0.0,0.82,0.18,92
92,@FoxNews,"Philadelphia Starbucks' embattled manager decides to leave company, report says (via @RyanGaydos) ",Apr 16,985947442813263873,1367531,71,173,17712647,-0.0516,0.0,0.909,0.091,93
93,@FoxNews,.@VP Pence gives keynote remarks at the @SpaceFoundation's 34th Annual National Space Symposium. ,Apr 16,985946712350056450,1367531,157,449,17712647,0.0,0.0,1.0,0.0,94
94,@FoxNews,Alligator casually strolls around Florida motel ,Apr 16,985945100164456448,1367531,154,452,17712647,0.1779,0.221,0.779,0.0,95
95,@FoxNews,People throw colored powder as they celebrate at the end of the Color Run 2018 race in front of the Eiffel Tower in Paris on April 15. ,Apr 16,985944325245800448,1367531,71,398,17712647,0.5719,0.121,0.879,0.0,96
96,@FoxNews,"Dog arrested for being a bad boy, picking fights with deer ",Apr 16,985943222643056641,1367531,360,1111,17712647,-0.8519,0.0,0.462,0.538,97
97,@FoxNews,"Earlier, @HillaryClinton tweeted well wishes to former First Lady Barbara Bush and her family. ",Apr 16,985936076270383104,1367531,54,360,17712647,0.4019,0.209,0.791,0.0,98
98,@FoxNews,#BostonMarathon winner Desiree Linden first American woman to win since 1985 ,Apr 16,985935408293924869,1367531,335,1534,17712647,0.8225,0.409,0.591,0.0,99
99,@FoxNews,A Kentucky police officer helped a mother duck and her babies cross the road ,Apr 16,985933688578994176,1367531,717,3343,17712647,0.0,0.0,1.0,0.0,100
100,@FoxNews,"Renegade driver lost police during chase, but got caught when he called to report his car was stolen ",Apr 16,985932131380744192,1367531,57,201,17712647,-0.714,0.0,0.741,0.259,101
101,@FoxNews,GAO says EPA violated spending law on Pruitt's privacy booth ,Apr 16,985931024117981185,1367531,40,104,17712647,-0.5267,0.0,0.746,0.254,102
102,@FoxNews,5-year-old gets Transformers party to mark end of tumor treatment ,Apr 16,985926265298391040,1367531,100,742,17712647,0.0258,0.189,0.629,0.182,103
103,@FoxNews,.@POTUS: “We cut regulations at a level that nobody’s seen in the history of our country… and we’re not finished yet.” ,Apr 16,985924687761944577,1367531,440,1721,17712647,-0.2732,0.0,0.905,0.095,104
104,@FoxNews,.@POTUS: “We have the biggest tax cut in history… The individual mandate is gone.” ,Apr 16,985924428449177600,1367531,387,1543,17712647,-0.2732,0.0,0.87,0.13,105
105,@FoxNews,".@POTUS: “Since election day, we’ve created 3 million new jobs.” ",Apr 16,985923294904946689,1367531,350,1273,17712647,0.25,0.182,0.818,0.0,106
106,@FoxNews,"Cohen attorneys say feds seized devices that have 'nothing to do' with warrant, rip 'unprecedented' search- via @brookefoxnews 
",Apr 16,985922208303341569,1367531,420,877,17712647,0.0,0.0,1.0,0.0,107
107,@FoxNews,.@POTUS: “We’ve had massive tax cuts.” ,Apr 16,985921265272803328,1367531,110,502,17712647,0.0,0.0,1.0,0.0,108
108,@FoxNews,".@POTUS: “Tomorrow is tax day… and remember this, this is the last time you’re going to fill out the long, complicated, horrible return.” ",Apr 16,985921175913197568,1367531,936,4239,17712647,-0.5423,0.0,0.868,0.132,109
109,@FoxNews,.@POTUS: “We’re doing tremendously. Companies are moving back into our country.” ,Apr 16,985920467247816704,1367531,905,3909,17712647,0.0,0.0,1.0,0.0,110
110,@FoxNews,.@POTUS hosts a roundtable on tax reform for Florida small businesses. ,Apr 16,985919394357407744,1367531,332,1004,17712647,0.0,0.0,1.0,0.0,111
111,@FoxNews,President @realDonaldTrump to host roundtable on tax reform ahead of former FBI Director James @Comey’s book release ,Apr 16,985915267262840832,1367531,387,1473,17712647,0.0,0.0,1.0,0.0,112
112,@FoxNews,".@POTUS arrives in Miami, Florida ahead of a tax roundtable. (Courtesy: WSVN) ",Apr 16,985913359945125889,1367531,284,1123,17712647,0.0,0.0,1.0,0.0,113
113,@FoxNews,North Carolina court writes cop-killer Assata Shakur $15G check as land deal compensation ,Apr 16,985910997197127682,1367531,97,109,17712647,0.0,0.0,1.0,0.0,114
114,@FoxNews,Cops cracking iPhones across the country with this device ,Apr 16,985909254950400000,1367531,121,139,17712647,0.0,0.0,1.0,0.0,115
115,@FoxNews,'A Man Without Courage': @AlanDersh Slams Comey for Leaking Trump Memos ,Apr 16,985906847914831872,1367531,465,1476,17712647,0.0,0.0,1.0,0.0,116
116,@FoxNews,Boston Marathon's first official female runner relives bombings: 'Running makes you fearless' ,Apr 16,985903203941277697,1367531,46,201,17712647,0.4404,0.195,0.805,0.0,117
117,@FoxNews,"RT @EricShawnTV: Russia is acting like a ""rogue"" country, #UN British Amb. @KarenPierceUN tells me @Foxnews. We have more on Syria and the…",Apr 16,985902257676877825,1367531,19,0,17712647,0.3612,0.106,0.894,0.0,118
118,@FoxNews,Israel destroys Hamas' 'longest and deepest' border tunnel yet ,Apr 16,985902195773190150,1367531,329,1330,17712647,-0.5574,0.0,0.714,0.286,119
119,@FoxNews,"R. Lee Ermey's most memorable roles, from 'Full Metal Jacket' to 'Toy Story' ",Apr 16,985898098135314432,1367531,146,729,17712647,0.0,0.0,1.0,0.0,120
120,@FoxNews,"FEC hit with lawsuit over ignoring civil complaint accusing Clinton, DNC in election scheme ",Apr 16,985894498432618496,1367531,1511,4209,17712647,-0.7579,0.0,0.564,0.436,121
121,@FoxNews,A circus performer dunked a basketball with a big assist from an elephant. The elephant used her trunk to throw the daredevil into the air above the rim. ,Apr 16,985890095130693632,1367531,343,1059,17712647,0.128,0.057,0.943,0.0,122
122,@FoxNews,"Trump blasts 'disgruntled' Comey, McCabe; suggests they 'committed many crimes' - via @brookefoxnews 
",Apr 16,985888667939074048,1367531,183,727,17712647,0.2732,0.149,0.851,0.0,123
123,@FoxNews,Dog and Deer Have Unexpected Morning Playdate ,Apr 16,985887466195431424,1367531,449,1899,17712647,0.0,0.0,1.0,0.0,124
124,@FoxNews,British choir visits US for 60th anniversary of American WWII memorial in London ,Apr 16,985886238682112000,1367531,84,322,17712647,0.0,0.0,1.0,0.0,125
125,@FoxNews,Firefighters mow lawn of veteran after responding to call ,Apr 16,985881176811458561,1367531,164,738,17712647,0.0,0.0,1.0,0.0,126
126,@FoxNews,OPINION: Michael Goodwin: @Comey proves he only cares about himself ,Apr 16,985880949085925376,1367531,329,1050,17712647,0.4588,0.231,0.769,0.0,127
127,@FoxNews,".@POTUS departs Washington, D.C. en route to Miami, Florida.  ",Apr 16,985879068217348097,1367531,261,994,17712647,0.0,0.0,1.0,0.0,128
