,News Account,News Text,News Created Date,News id,News Account id,Retweet Count,Like Count,Followers Count,News Compound,News Positive,News Neutral,News Negative,News Tweets Ago
2378,@ABC,Incredible video shows a cheetah on a hunt jumping into an SUV to find a better scouting spot. The passenger stayed quiet and didn’t make eye contact so the cheetah didn’t see him as a threat. ,Mar 29,979335065753628677,28785486,6123,14226,13926302,-0.128,0.076,0.836,0.089,2379
2379,@ABC,"Malala Yousafzai, the world’s youngest Nobel Peace Prize laureate, pauses to wipe away tears during an emotional speech on her first return to Pakistan since she was shot by the Taliban in 2012. ",Mar 29,979334292420595712,28785486,388,1009,13926302,0.7579,0.203,0.751,0.046,2380
2380,@ABC,At least 11 arrested during Black Lives Matter protest in New York as hundreds gathered to express their anger over the death of Stephon Clark. ,Mar 29,979330349045026817,28785486,100,129,13926302,-0.9118,0.031,0.615,0.355,2381
2381,@ABC,CLOSE CALL: Diver isn't fazed by his extremely close encounter with a great white shark while exploring the waters off Cape Schanck in Australia. ,Mar 29,979327708080627712,28785486,123,301,13926302,0.6249,0.146,0.854,0.0,2382
2382,@ABC,9-year-old girl missing since 2016 found safe after tip from TV show viewer. ,Mar 29,979326851708608513,28785486,84,269,13926302,0.1779,0.16,0.718,0.122,2383
2383,@ABC,"RT @GMA: ""We may not have it all together, but together we have it all."" 

@RoseanneOnABC sets record ratings as the Conners come roaring b…",Mar 29,979323622148931584,28785486,64,0,13926302,0.0,0.0,1.0,0.0,2384
2384,@ABC,Ruling by a Panamanian arbitrator upholds eviction of Trump Organization from Panama hotel. ,Mar 29,979322113067749376,28785486,264,767,13926302,-0.4588,0.0,0.812,0.188,2385
2385,@ABC,"Thousands march in Paris to pay tribute to Mireille Knoll, an 85-year-old Holocaust survivor who was murdered in a suspected anti-Semitic attack last week. ",Mar 29,979319851314540544,28785486,252,592,13926302,-0.8074,0.075,0.601,0.324,2386
2386,@ABC,"RT @GMA: Continued outrage following the shooting death of Stephon Clark, an unarmed black man, by police. Protests in Sacramento, NYC. @Ka…",Mar 29,979319297624412160,28785486,33,0,13926302,-0.8442,0.0,0.676,0.324,2387
2387,@ABC,"""I always dreamt of this moment"": Malala Yousafzai returns to Pakistan for the first time since she was shot by the Taliban for advocating for girls' education. ",Mar 29,979316988676919296,28785486,156,566,13926302,0.0,0.0,1.0,0.0,2388
2388,@ABC,"This Air Force cadet saved an apparently suicidal man and helped locate a downed plane -- all in the space of 72 hours. 

“To me, it’s about doing what’s right all the time and having the courage to act when it matters most,” he said. ",Mar 29,979314131080708096,28785486,134,595,13926302,0.1531,0.132,0.784,0.084,2389
2389,@ABC,"RT @GMA: Tornadoes and severe storms soak the south, and millions brace themselves for the next round of severe storms. @RobMarciano with t…",Mar 29,979314039997321216,28785486,51,0,13926302,-0.6369,0.0,0.802,0.198,2390
2390,@ABC,"MORE: David Shulkin was informed of his firing yesterday afternoon via a phone call from Chief of Staff John Kelly, and did not find out via Pres. Trump's tweets, administration officials tell @ABC News. ",Mar 29,979313206043824129,28785486,22,32,13926302,-0.34,0.0,0.934,0.066,2391
2391,@ABC,"Italian police arrest five people connected to Anis Amri, the man who carried out the 2016 Berlin Christmas market truck attack. ",Mar 29,979308465788157952,28785486,54,80,13926302,-0.6705,0.0,0.792,0.208,2392
2392,@ABC,Teen seen hugging a police officer in photo that went viral during Ferguson protests reported missing after family dies in car crash. ,Mar 29,979307223770959872,28785486,167,284,13926302,-0.4588,0.098,0.664,0.238,2393
2393,@ABC,68 people die after riot and fire at police station in Venezuela. ,Mar 29,979303672814473216,28785486,50,68,13926302,-0.872,0.0,0.526,0.474,2394
2394,@ABC,"Man who owes $500,000 in child support vanishes into the ocean on a paddleboard. ",Mar 29,979302566382235648,28785486,91,134,13926302,0.4019,0.162,0.838,0.0,2395
2395,@ABC,"Surveillance video shows a statue of David Bowie being vandalized 48 hours after it was unveiled in Aylesbury, England. ",Mar 29,979297809303302145,28785486,124,145,13926302,0.0,0.0,1.0,0.0,2396
2396,@ABC,"DEVELOPING: Vehicle driven at soldiers who were out jogging near their military barracks in south-eastern France, mayor of Varces-Allieres-et-Risset says. ",Mar 29,979292862624886784,28785486,46,42,13926302,0.0,0.0,1.0,0.0,2397
2397,@ABC,"White House distances itself from debate over police shootings of African Americans, saying issues regarding law enforcement are best left to local communities. ",Mar 29,979287813203079168,28785486,51,67,13926302,0.6369,0.149,0.851,0.0,2398
2398,@ABC,"French Pres. Macron delivers moving tribute to the hero police officer who died after swapping places with a hostage during last week's extremist attack. 

Lt. Col. Arnaud Beltrame was posthumously awarded the Legion of Honor, France's highest decoration. ",Mar 29,979287127702765568,28785486,70,187,13926302,0.4215,0.189,0.677,0.133,2399
2399,@ABC,"""Last call"": Fallen FBI agent honored in heartbreaking law enforcement ritual. ",Mar 29,979283044153651200,28785486,37,119,13926302,-0.1779,0.197,0.518,0.285,2400
2400,@ABC,"Canadian teen will receive $1,000 a week for life after winning the lottery. ",Mar 29,979280566205009920,28785486,44,179,13926302,0.5267,0.207,0.793,0.0,2401
2401,@ABC,Stranger who mistakenly received couple's wedding invite sends them a heartfelt note and a sweet surprise. ,Mar 29,979275247261138944,28785486,56,392,13926302,0.7906,0.436,0.47,0.094,2402
2402,@ABC,"Dangerous drug trend called ""wasping"" combines insecticide with meth. ",Mar 29,979274220403417088,28785486,53,46,13926302,-0.4767,0.0,0.763,0.237,2403
2403,@ABC,"SAVED BY A STRANGER: Four-year-old Zanyah Brown had her life saved by a 27-year-old she'd never met. He was her perfect match for a liver transplant, and her mother calls him ""a blessing."" ",Mar 29,979271505761722368,28785486,112,409,13926302,0.876,0.257,0.743,0.0,2404
2404,@ABC,Sheriff's deputy under investigation after fatally shooting unarmed man with his pants down. ,Mar 29,979268110401368064,28785486,63,56,13926302,-0.6369,0.0,0.769,0.231,2405
2405,@ABC,Germany's new interior minister has come under fire for picking only men to lead his ministry. ,Mar 29,979261385652756481,28785486,29,55,13926302,-0.34,0.0,0.876,0.124,2406
2406,@ABC,"Sen. Bob Menendez officially announces campaign for third term, with no mention of the corruption scandal that dogged him until two months ago. ",Mar 29,979260895653134336,28785486,16,33,13926302,-0.6249,0.0,0.819,0.181,2407
2407,@ABC,Alabama's first openly gay legislator receives standing ovation as she bids farewell to the state House of Representatives. ,Mar 29,979260380118732800,28785486,19,114,13926302,0.0,0.0,1.0,0.0,2408
2408,@ABC,Some Wisconsin students who took their demonstration against gun violence on the road have reached their destination—Speaker Paul Ryan's home turf. ,Mar 29,979258583408893952,28785486,46,189,13926302,-0.6908,0.099,0.671,0.23,2409
2409,@ABC,Incredible video shows a cheetah on a hunt jumping into a jeep to find a better scouting spot. The passenger stayed quiet and didn’t make eye contact so the cheetah didn’t see him as a threat. ,Mar 29,979253523052408832,28785486,44304,115677,13926302,-0.128,0.078,0.831,0.091,2410
2410,@ABC,"Footage released by NATO Special Operations Component Command in Afghanistan appears to show overnight raid that killed an ISIS commander, the latest in what the U.S. military calls a series of counterterrorism operations in northern Afghanistan. ",Mar 29,979252016517144576,28785486,59,111,13926302,-0.4215,0.064,0.829,0.107,2411
2411,@ABC,"Anthony Scaramucci says keeping quiet on Stormy Daniels scandal is the ""best strategy"" for the White House.

""The president is a Duraflame log and any time you throw him on a fire it blows into the stratosphere."" ",Mar 29,979250561383129088,28785486,17,54,13926302,-0.0258,0.097,0.782,0.122,2412
2412,@ABC,"MORE: North Korean leader Kim Jong Un is to meet South Korean Pres. Moon Jae-in at a border village on April 27, after the nations agreed on a rare summit. ",Mar 29,979249817342939136,28785486,37,71,13926302,0.2732,0.068,0.932,0.0,2413
2413,@ABC,"Voices from the #MarchForOurLives: ""The number of young people there willing to work hard for change just goes to show how powerful our generation is.” ",Mar 29,979248817559261184,28785486,29,116,13926302,0.4019,0.139,0.814,0.047,2414
2414,@ABC,Americans still love Labrador retrievers—but the nation's flirtation with French bulldogs has reached new heights. ,Mar 29,979244293910089728,28785486,32,114,13926302,0.8074,0.372,0.628,0.0,2415
2415,@ABC,JUST IN: North and South Korea agree to leaders' summit on April 27. ,Mar 29,979237568637218816,28785486,83,185,13926302,0.3612,0.161,0.839,0.0,2416
2416,@ABC,"Suspect makes daring escape from custody outside an Indiana jail, jumping from a squad car and fleeing under a closing gate. He was recaptured two days later. ",Mar 29,979236894130212864,28785486,88,190,13926302,0.25,0.138,0.789,0.072,2417
2417,@ABC,How to download the call list that Facebook may have access to. ,Mar 29,979229194759606272,28785486,44,57,13926302,0.0,0.0,1.0,0.0,2418
2418,@ABC,"Pope Francis stops the popemobile to let 12-year-old Peter, who has Down syndrome and leukemia, join him on his ride around St. Peter’s Square.

The Pontiff gave him a kiss and a balloon, making two of his wishes come true in one day. ",Mar 29,979221768224346118,28785486,296,1448,13926302,0.7783,0.192,0.776,0.033,2419
2419,@ABC,Proposed bill would fine employers for requiring their employees to respond after work hours. ,Mar 29,979214087929384961,28785486,93,228,13926302,0.2023,0.107,0.893,0.0,2420
2420,@ABC,"Need some motivation to hit the gym? We got you covered, with some help from this adorable corgi. ",Mar 29,979206695237890054,28785486,223,818,13926302,0.8074,0.328,0.672,0.0,2421
2421,@ABC,"Days after the March for Our Lives protest, a workshop teaching attendees to ""Build Your Own AR-15"" event draws demonstrators. ""It's a slap in the face to all the children that have died."" ",Mar 29,979206437493727235,28785486,155,266,13926302,-0.1027,0.046,0.896,0.058,2422
2422,@ABC,PLAY ON: A flute player performs during a brain surgery intended to help reduce her worsening hand tremors—and receives a huge round of applause from the doctors and nurses afterward. ,Mar 29,979201171708698624,28785486,460,1686,13926302,0.8788,0.352,0.573,0.075,2423
2423,@ABC,"Footage released by NATO Special Operations Component Command in Afghanistan appears to show overnight raid that killed an ISIS commander, the latest in what the U.S. military calls a series of counterterrorism operations in northern Afghanistan. ",Mar 29,979200064634675200,28785486,146,292,13926302,-0.4215,0.064,0.829,0.107,2424
2424,@ABC,"""This isn’t the first time she has outfoxed us"": When this little girl's pleas for a later bedtime didn't work, she decided to appeal to her parents in writing. ",Mar 29,979198996743884800,28785486,24,122,13926302,0.0,0.0,1.0,0.0,2425
2425,@ABC,Springtime means it’s baby buffalo season! Adorable baby buffalo calves have joined the herd at Custer State Park in South Dakota. ,Mar 29,979191662827266051,28785486,294,1333,13926302,0.5411,0.137,0.863,0.0,2426
2426,@ABC,"Heineken pulls ad Chance the Rapper called ""terribly racist."" ",Mar 29,979190165620121601,28785486,49,179,13926302,-0.3818,0.137,0.616,0.247,2427
2427,@ABC,"Three Facebook Messenger app file lawsuit, claiming the social network violated their privacy by collecting logs of their phone calls and text messages. ",Mar 29,979184641822339072,28785486,80,112,13926302,-0.6486,0.0,0.813,0.187,2428
2428,@ABC,Facebook giving its privacy tools a makeover as it reels from criticisms over its data practices and faces tighter European regulations in the coming months. ,Mar 29,979184387517448197,28785486,41,55,13926302,0.128,0.085,0.848,0.067,2429
2429,@ABC,Equifax hiring longtime financial industry executive as new CEO amid continued fallout from massive data breach. ,Mar 29,979184384778686465,28785486,18,11,13926302,0.0,0.0,1.0,0.0,2430
2430,@ABC,"""Roseanne"" reboot roars with 18 million-plus viewers—the biggest series debut this season: ",Mar 29,979182621933686784,28785486,123,669,13926302,0.0,0.0,1.0,0.0,2431
2431,@ABC,Facebook is facing yet another legal challenge—this time over ads that advocacy groups claim discriminate against people looking to rent an apartment or buy a house. ,Mar 29,979181863301500929,28785486,71,94,13926302,0.128,0.055,0.945,0.0,2432
2432,@ABC,"""Unbelievable!"" Residents are beside themselves as thousands of birds fly away from an approaching storm in South Australia. ",Mar 29,979176483154485248,28785486,420,896,13926302,0.0,0.0,1.0,0.0,2433
2433,@ABC,"Thailand temporary closes beach made famous by Leonardo DiCaprio movie ""The Beach"" to halt environmental damage caused by too many tourists. ",Mar 29,979174816275156992,28785486,111,330,13926302,-0.4939,0.0,0.873,0.127,2434
2434,@ABC,Bombing campaign by Saudi Arabia and its allies has left around 2.2 million Yemeni children malnourished—80% of them severely—as the country verges on a man-made famine. ,Mar 29,979169297279971329,28785486,103,70,13926302,0.0,0.0,1.0,0.0,2435
2435,@ABC,"Pres. Trump continues to hold out hope for personally working with Vladimir Putin, despite the U.S. accusing Russia of meddling worldwide. ",Mar 29,979169297112150022,28785486,41,60,13926302,0.5296,0.174,0.826,0.0,2436
2436,@ABC,House Democrats ask White House for findings of internal review stemming from meetings Jared Kushner had in the White House with officials from two major Wall Street firms that later gave his family’s real estate business loans. ,Mar 29,979169047395827712,28785486,76,130,13926302,0.0,0.0,1.0,0.0,2437
2437,@ABC,NRA tells leading Senate Democrat it accepted foreign donations but that they were not used for election-related activities. ,Mar 29,979168533761404929,28785486,47,56,13926302,0.1406,0.075,0.925,0.0,2438
2438,@ABC,"Former Trump campaign manager Paul Manafort wants charges in Virginia dismissed, calls Mueller probe a ""blank check."" ",Mar 29,979168020454092800,28785486,42,57,13926302,-0.2732,0.0,0.89,0.11,2439
2439,@ABC,"Pakistan's first trans TV anchor vows to use her role to change perceptions: ""Our society treats transgender people shamefully...I want to change that."" ",Mar 29,979165032276774912,28785486,114,292,13926302,0.0772,0.051,0.949,0.0,2440
2440,@ABC,"General-turned-president el-Sisi is all but certain to win Egypt’s presidential election—but with discontent high, even among his supporters, a big turnout is important to his mandate. ",Mar 29,979162987809427457,28785486,12,23,13926302,0.9313,0.377,0.623,0.0,2441
2441,@ABC,"CLOSE CALL: SUV backs through the front window of a café in Burlington, Washington, just barely missing a customer. ",Mar 28,979136957728153600,28785486,133,174,13926302,-0.2748,0.0,0.845,0.155,2442
2442,@ABC,"Adding the census question on citizenship may not have set off the political firestorm it did if so many immigrants did not already feel skeptical of this administration, writes @ABC's @maryaliceparks. ",Mar 28,979130797193072640,28785486,23,57,13926302,0.2411,0.058,0.942,0.0,2443
2443,@ABC,"NRA says it has received a single contribution from a Russian individual of less than $1,000 during the 2012-2018 election cycle. ",Mar 28,979128151107350529,28785486,67,116,13926302,0.0,0.0,1.0,0.0,2444
2444,@ABC,More than two dozen nations on three continents have vowed to boot out Russian diplomats in response to the poisoning of a former Russian spy in England. ,Mar 28,979120454391750656,28785486,41,95,13926302,-0.5859,0.0,0.877,0.123,2445
2445,@ABC,"Man who owes $500,000 in child support vanishes into the ocean on a paddleboard. ",Mar 28,979120426709409792,28785486,1027,1717,13926302,0.4019,0.162,0.838,0.0,2446
2446,@ABC,Former Disney Channel star joins White House press team. ,Mar 28,979113917996785665,28785486,23,69,13926302,0.0,0.0,1.0,0.0,2447
2447,@ABC,"@ABCPolitics MORE: Last week, Pres. Trump nominated White House Physician Ronny Jackson to receive a second star, promoting him to the rank of rear admiral. ",Mar 28,979113858576023553,28785486,7,7,13926302,0.5859,0.167,0.833,0.0,2448
2448,@ABC,"RT @ABCPolitics: @ABC MORE: ""Admiral Jackson is highly trained and qualified and as a service member himself, he has seen firsthand the tre…",Mar 28,979113777026289664,28785486,14,0,13926302,0.5149,0.137,0.863,0.0,2449
2449,@ABC,"Pres. Trump signs into law bill banning use of federal funds to pay for painted portraits of federal employees and representatives, to include the president and vice president. ",Mar 28,979113179476385797,28785486,104,251,13926302,-0.1027,0.0,0.954,0.046,2450
2450,@ABC,"MORE: David Shulkin out as secretary of Veterans Affairs, marking another high profile departure from Pres. Trump's cabinet. ",Mar 28,979110939189567488,28785486,51,60,13926302,0.0,0.0,1.0,0.0,2451
2451,@ABC,"MORE: ""I am thankful for Dr. David Shulkin’s service to our country and to our GREAT VETERANS!"" Pres. Trump says. ",Mar 28,979109758690123776,28785486,24,40,13926302,0.8945,0.339,0.661,0.0,2452
2452,@ABC,"BREAKING: Pres. Trump tweets that he will nominate White House Physician Ronny Jackson to lead the Department of Veterans Affairs, replacing David Shulkin. ",Mar 28,979109431098126336,28785486,173,202,13926302,0.0,0.0,1.0,0.0,2453
2453,@ABC,"Russian ex-spy, daughter first came into contact with nerve agent on home’s front door, UK police say. ",Mar 28,979109151249981441,28785486,51,39,13926302,0.0,0.0,1.0,0.0,2454
2454,@ABC,"DEVELOPING: San Francisco man allegedly brandished ax at group of people he was fighting with, then charged them with his car. At least one person has died: ",Mar 28,979107272411484162,28785486,63,40,13926302,-0.7845,0.0,0.76,0.24,2455
2455,@ABC,Miami personal injury lawyer accused of fatally hitting a woman with his Mercedes-Benz and fleeing the scene. ,Mar 28,979107027665465344,28785486,39,52,13926302,-0.8481,0.0,0.62,0.38,2456
2456,@ABC,"Court filings show associate of Manafort, Gates allegedly had ties to Russian intelligence. ",Mar 28,979100454922653696,28785486,76,117,13926302,0.4767,0.181,0.819,0.0,2457
2457,@ABC,This Florida woman thought she put her car in park when she ran back inside her house. It ended up in the pool instead. Fortunately no one was injured. ,Mar 28,979099532859527168,28785486,66,133,13926302,-0.5994,0.0,0.855,0.145,2458
2458,@ABC,"Pope Francis stops the popemobile to let 12-year-old Peter, who has Down syndrome and leukemia, join him on his ride around St. Peter’s Square.

The Pontiff gave him a kiss and a balloon, making two of his wishes come true in one day. ",Mar 28,979094829782175745,28785486,1418,6323,13926302,0.7783,0.192,0.776,0.033,2459
2459,@ABC,"""This isn’t the first time she has outfoxed us"": When this little girl's pleas for a later bedtime didn't work, she decided to appeal to her parents in writing. ",Mar 28,979091640844419072,28785486,28,143,13926302,0.0,0.0,1.0,0.0,2460
2460,@ABC,Students and parents gather to begin taking down memorial to Marjory Stoneman Douglas shooting victims; the items will be kept for a possible exhibit. ,Mar 28,979086857978961920,28785486,36,122,13926302,-0.3182,0.0,0.913,0.087,2461
2461,@ABC,One Florida professor has a wild way of handling tardiness: Have the late student bust a move in front of the class! ,Mar 28,979086368847605760,28785486,78,357,13926302,0.0,0.0,1.0,0.0,2462
2462,@ABC,What's at stake in the gerrymandering case in front of the Supreme Court: ,Mar 28,979082158441680896,28785486,23,54,13926302,0.5574,0.205,0.795,0.0,2463
2463,@ABC,Rapper Fetty Wap hands out gift cards to families at New Jersey supermarket just in time for Easter. ,Mar 28,979077095157567488,28785486,92,459,13926302,0.4404,0.132,0.868,0.0,2464
2464,@ABC,All 22 female senators are bringing public pressure on Senate leaders to debate legislation making it easier for people working in Congress to pursue claims of sexual harassment or discrimination. ,Mar 28,979072971745656844,28785486,77,244,13926302,-0.4404,0.075,0.773,0.152,2465
2465,@ABC,How to download the call list that Facebook may have access to. ,Mar 28,979067912911761411,28785486,41,50,13926302,0.0,0.0,1.0,0.0,2466
2466,@ABC,"Press Sec. Sanders says Alton Sterling shooting was ""certainly a terrible incident. This is something that is a local matter, and that's something that we feel should be left up to the local authorities. ",Mar 28,979064130903490560,28785486,43,101,13926302,-0.1531,0.093,0.824,0.082,2467
2467,@ABC,"RT @ABCPolitics: .@PressSec says she has no response to Stormy Daniels filing a motion to depose Pres. Trump. 

""I'm not going to get into…",Mar 28,979063850346696705,28785486,34,0,13926302,-0.296,0.0,0.909,0.091,2468
2468,@ABC,Israeli Prime Minister Benjamin Netanyahu discharged from the hospital after undergoing medical tests. ,Mar 28,979063411257565184,28785486,17,37,13926302,0.0,0.0,1.0,0.0,2469
2469,@ABC,"On whether White House is ""worried"" what Paul Manafort or Michael Flynn might tell Special Counsel, Press Sec. Sanders tells @CeciliaVega: ""There was no collusion, and we're very confident in that, and look forward to this process wrapping up."" ",Mar 28,979061299404402689,28785486,44,87,13926302,0.6115,0.133,0.819,0.047,2470
2470,@ABC,".@PressSec tells @CeciliaVega that White House counsel Ty Cobb ""is the person that would be most directly involved"" in any pardon discussions, ""and he's got a statement on that record that there's no discussion and there's consideration of those at this time in the White House."" ",Mar 28,979060179667832832,28785486,60,62,13926302,0.4019,0.098,0.858,0.044,2471
2471,@ABC,LIVE: Press Sec. Sarah Sanders holds daily press briefing at the White House. ,Mar 28,979059025101934598,28785486,29,43,13926302,0.0,0.0,1.0,0.0,2472
2472,@ABC,"Anthony Scaramucci tells @TheView keeping quiet on Stormy Daniels is the ""best strategy"" for the White House: 

""The president is a Duraflame log and any time you throw him on the fire, it blows into the stratosphere."" ",Mar 28,979057606651133952,28785486,28,65,13926302,0.4215,0.099,0.845,0.056,2473
2473,@ABC,"RT @TheView: Anthony @Scaramucci says the GOP's dismissal of Stormy Daniels' claims ""is completely hypocritical"" when they attacked the Cli…",Mar 28,979056417163436032,28785486,126,0,13926302,-0.7425,0.0,0.741,0.259,2474
2474,@ABC,"NEW: Jury enters deliberations in trial of Noor Salman, wife of Pulse nightclub shooting suspect Omar Mateen. ",Mar 28,979055764009619461,28785486,22,31,13926302,-0.296,0.0,0.885,0.115,2475
2475,@ABC,Corey Feldman says he was attacked in his car while stopped at a traffic light. ,Mar 28,979054094135545857,28785486,28,40,13926302,-0.5994,0.0,0.741,0.259,2476
2476,@ABC,"NEW: Netflix appoints former U.N. Amb. Susan Rice to its board of directors.

“For decades, she has tackled difficult, complex global issues with intelligence, integrity and insight and we look forward to benefiting from her experience and wisdom,"" the company says. ",Mar 28,979049525594808320,28785486,89,249,13926302,0.4939,0.121,0.826,0.053,2477
2477,@ABC,85-year-old Holocaust survivor's murder heightens fears of anti-Semitism in France. ,Mar 28,979049400973582336,28785486,48,75,13926302,-0.8176,0.0,0.571,0.429,2478
2478,@ABC,"RT @ABCPolitics: @ABC NEW: Trump, May ""agreed on the importance of dismantling Russia’s spy networks in the United Kingdom and the United S…",Mar 28,979048726646882305,28785486,22,0,13926302,0.8481,0.349,0.651,0.0,2479
2479,@ABC,"Suspect makes daring escape from custody outside an Indiana jail, jumping from a squad car and fleeing under a closing gate. He was recaptured two days later. ",Mar 28,979045042575872000,28785486,104,285,13926302,0.25,0.138,0.789,0.072,2480
2480,@ABC,Americans still love Labrador retrievers—but the nation's flirtation with French bulldogs has reached new heights. ,Mar 28,979040213413629952,28785486,47,169,13926302,0.8074,0.372,0.628,0.0,2481
2481,@ABC,Judge dismisses involuntary manslaughter charges against five former Penn State fraternity brothers in hazing case. ,Mar 28,979035541051183108,28785486,109,94,13926302,-0.2732,0.0,0.884,0.116,2482
2482,@ABC,"MORE: Suspect arrested for allegedly ""threatening to shoot up"" a high school had a military vest and ammunition at his home, police say. ",Mar 28,979031080194985985,28785486,80,105,13926302,-0.9201,0.0,0.592,0.408,2483
2483,@ABC,"Commercial real estate agent mysteriously vanishes into the ocean on a paddleboard, police say. ",Mar 28,979029822918856705,28785486,43,53,13926302,0.0,0.0,1.0,0.0,2484
2484,@ABC,"RT @ABCPolitics: NEW: British Prime Minister Theresa May praised U.S. expulsion of Russian intelligence officers as a ""very strong response…",Mar 28,979024982260019202,28785486,34,0,13926302,0.8718,0.382,0.618,0.0,2485
2485,@ABC,"18-year-old exchange student from Taiwan arrested for allegedly ""threatening to shoot up"" a Pennsylvania high school. ",Mar 28,979023564509728768,28785486,162,174,13926302,-0.836,0.0,0.594,0.406,2486
2486,@ABC,"""Does this look like a gun to you?"" 

Hundreds hold up their phones at special city council meeting in Sacramento, protesting fatal police shooting of Stephon Clark. ",Mar 28,979023013898280961,28785486,209,412,13926302,-0.5423,0.141,0.623,0.236,2487
2487,@ABC,"NEW: U.S. airstrike kills Musa Abu Dawud, high-ranking al Qaeda figure in Libya; no civilians were killed, AFRICOM says. ",Mar 28,979021252869410816,28785486,477,1660,13926302,-0.8807,0.0,0.625,0.375,2488
