,News Account,News Text,News Created Date,News id,News Account id,Retweet Count,Like Count,Followers Count,News Compound,News Positive,News Neutral,News Negative,News Tweets Ago
1499,@ABC,"POLICE PUPS' FIRST DAY: The most adorable new additions to the Australian Federal Police’s K9 team ""are fur-ociously keen to fight crime,"" their human colleagues say. ",Apr 05,982013788118544384,28785486,954,4151,13926301,0.5256,0.178,0.744,0.077,1500
1500,@ABC,UPDATE: U.S. Marine Corps corrects Lance Corporal's name to Taylor J. Conrad. ,Apr 05,982010052495249408,28785486,27,59,13926301,0.0,0.0,1.0,0.0,1501
1501,@ABC,"NEW: Michael Cohen spokesperson responds to Pres. Trump's comments denying knowledge of Stormy Daniels payment.

“That is an accurate assessment of the facts."" ",Apr 05,982008167163973637,28785486,35,57,13926301,-0.34,0.0,0.909,0.091,1502
1502,@ABC,"NEW: Pres. Trump tells reporters he did not know about $130,000 payment to Stormy Daniels before the 2016 election. ",Apr 05,982007087323648001,28785486,333,483,13926301,0.0,0.0,1.0,0.0,1503
1503,@ABC,"MORE: Pres. Trump claimed not to know where the money Michael Cohen used for the payment came from, and directed further inquiries to the attorney himself.

“You’ll have to ask Michael Cohen,” Trump said. ",Apr 05,982006863393902595,28785486,46,86,13926301,0.0,0.0,1.0,0.0,1504
1504,@ABC,Incredible video shows an aerial view of Kilauea Volcano’s summit lava lake amid clear skies and sunshine on the Hawaiian Islands. ,Apr 05,982005371425427456,28785486,214,474,13926301,0.7003,0.216,0.784,0.0,1505
1505,@ABC,"JUST IN: Pres. Trump tells reporters he did not know about $130,000 payment to Stormy Daniels before the 2016 election.",Apr 05,982000525032984576,28785486,219,464,13926301,0.0,0.0,1.0,0.0,1506
1506,@ABC,"Air Force identifies Thunderbirds pilot killed in F-16 crash in Nevada yesterday as Maj. Stephen Del Bagno, an experienced pilot with more than 3,500 hours of flight time. ",Apr 05,981998832455217159,28785486,79,144,13926301,-0.802,0.0,0.795,0.205,1507
1507,@ABC,"NEW: Three gang members agree to plead guilty to hate crimes charges for firebombing African-American residences in Los Angeles, DOJ says. ",Apr 05,981998277997596673,28785486,67,76,13926301,-0.7269,0.086,0.619,0.296,1508
1508,@ABC,"NEW: Marine Corps identifies four Marines killed in helicopter crash this week in Southern California: 

-Capt. Samuel A. Schultz, 28.
-First Lt. Samuel D. Phillips, 27.
-Gunnery Sgt. Richard Holley, 33
-Lance Cpl. Joseph Conrad, 24. ",Apr 05,981997374196379649,28785486,89,124,13926301,-0.802,0.0,0.833,0.167,1509
1509,@ABC,"Scientists in Antarctica harvest first crop of vegetables grown without earth, daylight or pesticides, part of a project designed to help astronauts cultivate fresh food on other planets. ",Apr 05,981997009426141184,28785486,164,402,13926301,0.6124,0.156,0.844,0.0,1510
1510,@ABC,Quake cam shows needle registering magnitude-5.3 earthquake in Southern California. No significant damage reported. ,Apr 05,981996492733976576,28785486,136,181,13926301,-0.5574,0.089,0.644,0.267,1511
1511,@ABC,"UK, Australia investigating Facebook amid Cambridge Analytica data scandal. ",Apr 05,981991774095925248,28785486,55,89,13926301,-0.4404,0.0,0.775,0.225,1512
1512,@ABC,"Drone footage shows a shipwreck off the coast Cape Fear, North Carolina. Experts believe it was an iron-hulled steamer from the Civil War era. ",Apr 05,981986528095334400,28785486,451,1344,13926301,-0.7964,0.0,0.764,0.236,1513
1513,@ABC,LATEST: Earthquake upgraded to magnitude-5.3; currently no tsunami danger.,Apr 05,981982604672094210,28785486,141,219,13926301,-0.6808,0.0,0.556,0.444,1514
1514,@ABC,"JUST IN: Magnitude-5.0 earthquake strikes Southern California, 78km SW of Channel Islands Beach. ",Apr 05,981978597798957057,28785486,990,976,13926301,-0.3612,0.0,0.839,0.161,1515
1515,@ABC,"Justin Timberlake made a lifelong fan’s dream come true when he stopped his concert in Detroit to help her announce her pregnancy. “This was the most amazing, magical, unforgettable moment I have ever had in my life!” ",Apr 05,981977997459652609,28785486,126,677,13926301,0.8746,0.26,0.699,0.041,1516
1516,@ABC,"""Remember my opening remarks at Trump Tower,"" Pres. Trump says. ""I used the word rape—and yesterday it came out where this journey coming up, women are raped at levels that nobody's ever seen before. They don't want to mention that."" ",Apr 05,981977535885008897,28785486,64,104,13926301,-0.7024,0.0,0.873,0.127,1517
1517,@ABC,"NEW: GOP Rep. Elise Stefanik ""believes it’s in the best interest of the EPA for Mr. Pruitt to resign,"" her spokesperson says.

Twelve lawmakers, including three Republicans, have called for the embattled EPA chief to resign or be fired. ",Apr 05,981974707871371264,28785486,80,160,13926301,0.296,0.143,0.737,0.12,1518
1518,@ABC,"Stormy and cold weather will continue for the Midwest and Northeast through the weekend, with more snow expected. ",Apr 05,981971015470407680,28785486,28,46,13926301,0.0,0.0,1.0,0.0,1519
1519,@ABC,SKY HIGH: Spectacular cockpit video shows airborne squad of Royal Australian Air Force fighter jets refueling from a tanker aircraft mid-flight. ,Apr 05,981970732577185793,28785486,275,761,13926301,0.1531,0.071,0.929,0.0,1520
1520,@ABC,"Pres. Trump tosses his prepared remarks at roundtable on tax reform. 

""I'm reading off the first paragraph, I said, 'This is boring. Come on. We have to tell it like it is.'"" ",Apr 05,981966387827556353,28785486,476,807,13926301,0.2732,0.12,0.817,0.063,1521
1521,@ABC,"Discussing immigration laws, Pres. Trump references controversial remarks from campaign launch.

""I used the word rape—and yesterday it came out where this journey coming up, women are raped at levels that nobody's ever seen before. They don't want to mention that."" ",Apr 05,981964910279077888,28785486,43,74,13926301,-0.7665,0.0,0.837,0.163,1522
1522,@ABC,"Pres. Trump: ""For many years no president wanted to go against China economically, and we're going to do it."" ",Apr 05,981963726659047425,28785486,55,125,13926301,-0.296,0.0,0.901,0.099,1523
1523,@ABC,"Special counsel Robert Mueller will navigate uncharted waters when wrapping Russia probe, legal experts tell @ABC. ",Apr 05,981962877639774214,28785486,32,81,13926301,0.4939,0.208,0.792,0.0,1524
1524,@ABC,"RT @ABCPolitics: Pres. Trump criticizes Sen. Joe Manchin in West Virginia for voting against last year's tax bill: ""I thought he would be h…",Apr 05,981962755921063936,28785486,41,0,13926301,-0.34,0.0,0.906,0.094,1525
1525,@ABC,LIVE: Pres. Trump attends tax reform roundtable. ,Apr 05,981960977502613505,28785486,58,117,13926301,0.0,0.0,1.0,0.0,1526
1526,@ABC,"LATEST: There were no signs of foul play and the preliminary cause of death is drowning, medical examiner says. ",Apr 05,981959161368989697,28785486,44,50,13926301,-0.5719,0.091,0.679,0.23,1527
1527,@ABC,"Senators from major soybean-producing states, including Republicans, are blaming Pres. Trump's aggressive actions against China for trade retaliation that could hit farmers and ranchers particularly hard. ",Apr 05,981958153775566849,28785486,502,736,13926301,-0.6697,0.0,0.794,0.206,1528
1528,@ABC,"Florida man who posed as U.S. military veteran and claimed to have earned more than 20 medals and badges has been arrested, police say. ",Apr 05,981953447363784705,28785486,74,207,13926301,-0.4767,0.0,0.89,0.11,1529
1529,@ABC,Officer who confronted gunman inside Maryland school to throw first pitch at Nationals game. ,Apr 05,981948795574456320,28785486,290,1788,13926301,-0.2023,0.0,0.893,0.107,1530
1530,@ABC,@LMartinezABC MORE: U.S. military cancels remainder of “Alligator Dagger” exercise in Djibouti following back-to-back accidents involving Marine aircraft. ,Apr 05,981947562323271681,28785486,18,24,13926301,-0.6278,0.0,0.768,0.232,1531
1531,@ABC,"""His dream is still within all of us."" 

Dozens of celebrities appear in Stevie Wonder video honoring Martin Luther King Jr. ",Apr 05,981943848510386177,28785486,63,212,13926301,0.6486,0.202,0.798,0.0,1532
1532,@ABC,"“Nothing’s been enacted,"" Larry Kudlow tells @CeciliaVega about farmers' concerns over proposed tariffs.

""I appreciate the concerns, absolutely, but give us some time to play this out...We can fix this thing, this could have a great ending.” ",Apr 05,981939375813615616,28785486,36,46,13926301,0.891,0.232,0.768,0.0,1533
1533,@ABC,NEW: UK Information Commissioner’s Office investigating Facebook amid Cambridge Analytica scandal; the office is also conducting broader probe into role of social media in campaigning.,Apr 05,981937039699578880,28785486,61,113,13926301,-0.4404,0.0,0.892,0.108,1534
1534,@ABC,MORE: Body of missing CDC worker Timothy Cunningham found nearly two months after disappearance. ,Apr 05,981936374290026496,28785486,231,202,13926301,-0.4807,0.0,0.828,0.172,1535
1535,@ABC,"NEW: Body of missing CDC employee Timothy Cunningham found in Chattahoochee River in northwest Atlanta, police say. Cunningham had disappeared in Atlanta on February 12.",Apr 05,981933558859292672,28785486,675,541,13926301,-0.4767,0.0,0.849,0.151,1536
1536,@ABC,"RT @ABC2020: So many strong hardworking American women living paycheck to paycheck – are facing threats, humiliation, &amp; danger at work. Now…",Apr 05,981931969452879872,28785486,58,0,13926301,-0.7447,0.117,0.558,0.325,1537
1537,@ABC,NEW: U.S. cancels ongoing exercise in Djibouti's at the country's request following two back-to-back aviation accidents involving Marine aircraft. -@LMartinezABC,Apr 05,981931192609013763,28785486,55,86,13926301,-0.4939,0.0,0.811,0.189,1538
1538,@ABC,"Scary video shows crane collapsing at a Florida construction site. Thankfully, there were no injuries, and the incident caused minimal damage. ",Apr 05,981931010546860032,28785486,158,241,13926301,-0.7906,0.092,0.556,0.353,1539
1539,@ABC,New York attorney general opens probe into fatal police shooting of man who allegedly pointed metal pipe at police officers. ,Apr 05,981926014505963520,28785486,45,73,13926301,-0.5423,0.0,0.857,0.143,1540
1540,@ABC,"Stunning timelapse video shows the sky changing colors during a thunderstorm in Kimball, South Dakota. ",Apr 05,981924831146004485,28785486,254,769,13926301,0.3818,0.148,0.852,0.0,1541
1541,@ABC,"MORE: Ex-spy's daughter, who was poisoned in nerve agent attack last month, has spoken to a relative and police. ",Apr 05,981924103169994753,28785486,39,89,13926301,-0.743,0.0,0.741,0.259,1542
1542,@ABC,"SAVED: Firefighters' incredible rescue efforts are caught on camera after a gardener fell 60 feet down an abandoned well in Santa Barbara, California. ",Apr 05,981917428459425793,28785486,56,212,13926301,0.7125,0.28,0.626,0.094,1543
1543,@ABC,"Massive sandstorm sweeps parts of China’s Inner Mongolia region, drastically reducing visibility and creating an eerie orange sky. ",Apr 05,981913020577304577,28785486,91,209,13926301,-0.0772,0.097,0.793,0.11,1544
1544,@ABC,"DETAILS: A tour bus headed to the Masters Tournament overturned this morning, officials say; the driver has been charged with driving under the influence. ",Apr 05,981912252243693569,28785486,87,75,13926301,-0.2023,0.0,0.93,0.07,1545
1545,@ABC,"Father of alleged YouTube shooter apologizes: ""I am sorry. I can't believe it."" ",Apr 05,981908317927862272,28785486,30,94,13926301,0.296,0.158,0.759,0.082,1546
1546,@ABC,"RT @ABCPolitics: DHS Sec. Nielsen says she spoke with CA Gov. Jerry Brown on plans to deploy National Guard to the border. 

“He has seen t…",Apr 05,981907969158844417,28785486,29,0,13926301,0.0,0.0,1.0,0.0,1547
1547,@ABC,"DEVELOPING: Several people injured on overturned tour bus in Columbia County, GA; injuries are non-life threatening. The bus driver has been charged with a DUI.",Apr 05,981903851690381312,28785486,91,131,13926301,-0.7845,0.0,0.727,0.273,1548
1548,@ABC,Karamel the squirrel lost his front paws when he got caught in a trap. Now he’s got a fancy new set of wheels to help him get around. ,Apr 05,981902428391043072,28785486,575,1926,13926301,-0.2263,0.084,0.774,0.142,1549
1549,@ABC,"NEW: Twitter says it suspended 1.2 million accounts ""for violations related to the promotion of terrorism"" between August 2015 and December 2017. ",Apr 05,981898131834130433,28785486,206,300,13926301,-0.9022,0.0,0.643,0.357,1550
1550,@ABC,"NEW: Top aide to EPA Administrator Scott Pruitt abruptly resigned last week, sources tell @ABC. ",Apr 05,981894451584012288,28785486,101,169,13926301,-0.0516,0.101,0.787,0.112,1551
1551,@ABC,"TV's original 'Wonder Woman,' Lynda Carter, honored with a star on the Hollywood Walk of Fame. 

""'Wonder Woman' gave birth to my career and now we have come full circle."" ",Apr 05,981891815937904641,28785486,291,1323,13926301,0.8402,0.243,0.757,0.0,1552
1552,@ABC,Brazen daylight robbery caught on camera as a seagull allegedly steals a pack of bacon from a woman’s shopping cart in Scotland. ,Apr 05,981887272340639745,28785486,308,831,13926301,-0.5106,0.0,0.858,0.142,1553
1553,@ABC,"Former Brazilian President Luiz Inacio da Silva can be jailed for upheld corruption conviction, Brazil's top court rules. ",Apr 05,981882675156996097,28785486,26,60,13926301,-0.34,0.078,0.783,0.139,1554
1554,@ABC,"JUST IN: UK police release statement on behalf of Yulia Skripal, ex-spy's daughter poisoned in nerve agent attack.

“I woke up over a week ago now and am glad to say my strength is growing daily. I am grateful for...the many messages of goodwill that I have received."" ",Apr 05,981882184914165760,28785486,133,370,13926301,0.5574,0.191,0.699,0.11,1555
1555,@ABC,"Despite cold temperatures plaguing much of the East Coast, cherry blossom season is in full swing in Washington, D.C.! ",Apr 05,981881143074025473,28785486,144,476,13926301,0.0,0.0,1.0,0.0,1556
1556,@ABC,This four-month-old okapi has been named after Meghan Markle in celebration of the forthcoming royal wedding. ,Apr 05,981876646406959114,28785486,26,171,13926301,0.0,0.0,1.0,0.0,1557
1557,@ABC,"High winds blew the roof off a school cafeteria in southern Kansas as a powerful storm system moved through the Midwest. 

Meteorologists reported wind gusts upwards of 60 mph in the area. ",Apr 05,981874944987541504,28785486,282,358,13926301,0.4215,0.083,0.917,0.0,1558
1558,@ABC,RT @GMA: A civil jury in San Diego Superior Court has found Adam Shacknai responsible for the mysterious death of Rebecca Zahau and awarded…,Apr 05,981872509657153536,28785486,58,0,13926301,0.2263,0.195,0.673,0.131,1559
1559,@ABC,"POLICE PUPS' FIRST DAY: The most adorable new additions to the Australian Federal Police’s K9 team ""are fur-ociously keen to fight crime,"" their human colleagues say. ",Apr 05,981870096430829568,28785486,1882,8010,13926301,0.5256,0.178,0.744,0.077,1560
1560,@ABC,"RT @GMA: Facebook now says up to 87 million users' data improperly shared. That's roughly 1 in 3 Facebook users: 

@…",Apr 05,981868000549769216,28785486,83,0,13926301,0.34,0.112,0.888,0.0,1561
1561,@ABC,"""I do have concerns about what an increase in availability of legal marijuana means for adolescents and what it means for folks who struggle with addiction and mental health,"" Rep. Joe Kennedy III tells Jimmy Kimmel. ",Apr 05,981865332154490880,28785486,62,226,13926301,0.128,0.092,0.852,0.056,1562
1562,@ABC,"NEW: Pres. Trump praises ""the strong immigration laws of Mexico"" as he tweets reaction to dispersing of Central American migrant caravan. ",Apr 05,981864793328975872,28785486,31,54,13926301,0.7717,0.242,0.758,0.0,1563
1563,@ABC,BEAUTY OF NATURE: Masses of ice sparkle in the sun after forming on the Ulungur Lake in China. ,Apr 05,981863928635543552,28785486,48,155,13926301,0.8091,0.289,0.711,0.0,1564
1564,@ABC,"YouTube shooting highlights danger of open work spaces, expert says. ",Apr 05,981863281806729221,28785486,71,122,13926301,-0.5267,0.0,0.764,0.236,1565
1565,@ABC,RT @GMA: New details in the investigation on the YouTube shooter - did authorities miss an opportunity to stop her? ,Apr 05,981862070479138816,28785486,25,0,13926301,0.0,0.119,0.72,0.161,1566
1566,@ABC,"Looter sentenced to 20 years in prison for stealing over $5,000 worth of TVs and cigarettes during Hurricane Harvey. ",Apr 05,981860270560727041,28785486,73,185,13926301,-0.7351,0.07,0.63,0.3,1567
1567,@ABC,Facebook now says up to 87 million users' data may have been improperly shared with Cambridge Analytica. ,Apr 05,981859030418296835,28785486,91,106,13926301,0.34,0.118,0.882,0.0,1568
1568,@ABC,"Pruitt's EPA should not have paid for busted condo door, congresswoman Betty McCollum says. 

“I know that Congress appropriates money for the EPA to protect human health and the environment -- not for repairs to the administrator's residence.” ",Apr 05,981858753917177862,28785486,79,177,13926301,0.3818,0.062,0.938,0.0,1569
1569,@ABC,"RT @GMA: EPA's Scott Pruitt speaks out about criticism of living arrangement: 

@marykbruce reports from Huntington,…",Apr 05,981858147550801920,28785486,21,0,13926301,-0.4404,0.0,0.847,0.153,1570
1570,@ABC,"""A president who thrives on words is signaling that his words don’t actually dictate policy,"" writes @ABC's @rickklein. ",Apr 05,981857255657177088,28785486,28,62,13926301,0.0,0.0,1.0,0.0,1571
1571,@ABC,"Mississippi flag is ""racially demeaning and hostile,"" says a new federal lawsuit that seeks to ban one city from any public display of the state banner. ",Apr 05,981855999631024128,28785486,50,119,13926301,-0.6705,0.0,0.82,0.18,1572
1572,@ABC,"RT @GMA: ""Point of crisis.""

President Trump signs proclamation authorizing National Guard to southern border: 

@Ce…",Apr 05,981853471623311360,28785486,25,0,13926301,0.0,0.0,1.0,0.0,1573
1573,@ABC,Buses are seen leaving the US Embassy compound in Moscow in the wake of Russia ordering the expulsion of 60 American diplomats. ,Apr 05,981853457303916544,28785486,125,177,13926301,0.0,0.0,1.0,0.0,1574
1574,@ABC,A pilot with the Air Force's elite Thunderbirds flight-demonstration team died Wednesday when the pilot's F-16 crashed near Nellis AFB outside Las Vegas. ,Apr 05,981849010028892160,28785486,58,92,13926301,-0.5574,0.0,0.859,0.141,1575
1575,@ABC,"Man holding metal pipe fatally shot by NYPD officers who believed he was pointing a gun, authorities say. ",Apr 05,981843992252960768,28785486,57,59,13926301,-0.765,0.0,0.72,0.28,1576
1576,@ABC,"Florida newspaper executive says new tariffs could add more than $3 million to paper's newsprint bill. ""Important stories will go uncovered."" ",Apr 05,981839889825259525,28785486,55,82,13926301,0.2023,0.076,0.924,0.0,1577
1577,@ABC,Full White House memorandum as Pres. Trump signs proclamation authorizing National Guard to southern border. ,Apr 05,981839377134481408,28785486,38,47,13926301,0.0,0.0,1.0,0.0,1578
1578,@ABC,SKY HIGH: Spectacular cockpit video shows airborne squad of Royal Australian Air Force fighter jets refueling from a tanker aircraft mid-flight. ,Apr 05,981838089764114433,28785486,399,1225,13926301,0.1531,0.071,0.929,0.0,1579
1579,@ABC,South Korean fighter jet crashes on mountain in country's rural south; no word on what caused the crash or whether both pilots safely ejected. ,Apr 05,981834697885077505,28785486,46,49,13926301,-0.0258,0.151,0.694,0.155,1580
1580,@ABC,Bollywood actor Salman Khan sentenced to five years in prison as he is convicted of poaching rare deer in a wildlife preserve. ,Apr 05,981829137286430720,28785486,99,258,13926301,-0.5267,0.0,0.827,0.173,1581
1581,@ABC,Facebook now says up to 87 million users' data may have been improperly shared with Cambridge Analytica. ,Apr 05,981824283394572288,28785486,105,84,13926301,0.34,0.118,0.882,0.0,1582
1582,@ABC,New England Patriots receiver Julian Edelman lauded for flagging possible school shooting threat on Instagram. ,Apr 05,981819481977696256,28785486,37,82,13926301,-0.5267,0.0,0.825,0.175,1583
1583,@ABC,"These service dogs had a magical day visiting Disneyland, with each one getting their own set of Mickey Mouse ears and even meeting their favorite characters! ",Apr 05,981813846502510592,28785486,2389,6621,13926301,0.5093,0.112,0.888,0.0,1584
1584,@ABC,NATURAL BEAUTY: Hiker captures incredible timelapse video of clouds rolling over the summit of Mt. Halcon in the Philippines. ,Apr 05,981808878361939968,28785486,581,1722,13926301,0.8301,0.29,0.71,0.0,1585
1585,@ABC,"This was the sketch one UK police force issued in the hope that social media users would help them catch a burglary suspect. 

Instead, the internet thought it was a prank. ",Apr 05,981803786703396864,28785486,45,94,13926301,0.5267,0.156,0.782,0.061,1586
1586,@ABC,"Parkland shooting survivor, who shielded fellow classmates from a barrage of gunfire, released from the hospital almost two months after the massacre. ",Apr 05,981798941179174912,28785486,180,897,13926301,0.3612,0.102,0.898,0.0,1587
1587,@ABC,These are some of the products that could be impacted by the tariff tiff between the U.S. and China: ,Apr 05,981794812578934784,28785486,50,81,13926301,0.0,0.0,1.0,0.0,1588
1588,@ABC,"Authorities are calling a Minnesota woman ""one of the worst DUI offenders in the U.S."" after her 7th arrest in as many states. ",Apr 05,981790639259095041,28785486,44,78,13926301,-0.8402,0.0,0.7,0.3,1589
1589,@ABC,"Senators from major soybean-producing states, including Republicans, are blaming Pres. Trump's aggressive actions against China for trade retaliation that could hit farmers and ranchers particularly hard. ",Apr 05,981785737870958592,28785486,112,216,13926301,-0.6697,0.0,0.794,0.206,1590
1590,@ABC,NASA partnering with Lockheed Martin to develop experimental manned airplane capable of traveling faster than speed of sound while staying relatively quiet. ,Apr 05,981781521630720000,28785486,58,154,13926301,0.3818,0.102,0.898,0.0,1591
1591,@ABC,"Ryan Murphy has nixed the idea of doing an ""American Crime Story"" season about Monica Lewinsky after all. ",Apr 05,981776792318078977,28785486,19,77,13926301,-0.5423,0.0,0.844,0.156,1592
1592,@ABC,"DHS Sec. Nielsen says replacing current sections of border wall would count as ""new wall"": ""To us, it's all new wall...This is the Trump border wall."" ",Apr 05,981772510156021762,28785486,232,421,13926301,0.0,0.0,1.0,0.0,1593
1593,@ABC,Two men arrested at New York City's JFK Airport for allegedly smuggling finches from Guyana. ,Apr 05,981767820559216640,28785486,31,70,13926301,-0.7351,0.0,0.708,0.292,1594
1594,@ABC,"YouTube shooter appears to have carried out her attack because she was ""upset"" with the company's ""policies and practices,"" authorities say. ",Apr 05,981763664922533889,28785486,59,92,13926301,-0.4767,0.0,0.876,0.124,1595
1595,@ABC,"Thousands of teachers in Oklahoma are protesting over salaries and education funding. 

One teacher told @ABC's @Clayton_Sandell, “I’m using textbooks that are about 20 years old.” ",Apr 05,981759385386082304,28785486,158,377,13926301,-0.4215,0.0,0.906,0.094,1596
1596,@ABC,"Florida man who posed as U.S. military veteran and claimed to have earned more than 20 medals and badges has been arrested, police say. ",Apr 05,981754660943007744,28785486,91,259,13926301,-0.4767,0.0,0.89,0.11,1597
1597,@ABC,"Jail chaplain says ""affluenza teen"" is ""close to fully understanding"" his impact on crash victims' families. ",Apr 05,981749990564483072,28785486,21,65,13926301,-0.6124,0.0,0.762,0.238,1598
1598,@ABC,"Looter sentenced to 20 years in prison for stealing over $5,000 worth of TVs and cigarettes during Hurricane Harvey. ",Apr 05,981745012156305408,28785486,111,276,13926301,-0.7351,0.07,0.63,0.3,1599
1599,@ABC,"JUST IN: Air Force says pilot of F-16 fighter jet that crashed during training flight at Nellis AFB in Nevada has died. 

The pilot was a member of the Air Force's elite Thunderbirds flight team. ",Apr 05,981744256493633537,28785486,115,108,13926301,-0.4588,0.041,0.867,0.092,1600
1600,@ABC,"Civil rights hero John Lewis: Martin Luther King, Jr. ""taught us how to stand up.""

""When you see something that is not right...you have a moral obligation to say something, to do something. You cannot be quiet."" ",Apr 05,981742421158580229,28785486,689,2072,13926302,0.5574,0.089,0.911,0.0,1601
1601,@ABC,"Parkland shooting survivor, who shielded fellow classmates from a barrage of gunfire, released from the hospital almost two months after the massacre. ",Apr 05,981738263181430785,28785486,315,1601,13926302,0.3612,0.102,0.898,0.0,1602
1602,@ABC,"Amazon patent reveals ""voice sniffer algorithm"" that could be used to analyze conversations. ",Apr 05,981734195826487298,28785486,215,170,13926302,0.1779,0.108,0.892,0.0,1603
1603,@ABC,Jury awards Rebecca Zahau family $5 million over mysterious Coronado mansion death. ,Apr 05,981730923942162432,28785486,36,83,13926302,-0.2263,0.159,0.635,0.206,1604
1604,@ABC,"Have you ever woken up thirsty? This adorable bear was so thirsty after hibernating for the winter, it started licking the snow surrounding its tree! ",Apr 05,981728594941677571,28785486,305,1372,13926302,0.5411,0.118,0.882,0.0,1605
1605,@ABC,"Jury selection in Cosby retrial erupts after prosecutors moved to strike a black woman from the pool, prompting the defense to claim racial discrimination. ",Apr 05,981724884442271745,28785486,52,73,13926302,0.0,0.058,0.885,0.058,1606
1606,@ABC,Dozens of bags of mail recovered from backyard shed belonging to Long Island postal worker. ,Apr 05,981723118766051329,28785486,81,98,13926302,0.0,0.0,1.0,0.0,1607
1607,@ABC,Twitter cracks down on accounts accused of spreading false info after YouTube shooting. ,Apr 05,981720853216944129,28785486,87,237,13926302,-0.296,0.0,0.864,0.136,1608
1608,@ABC,"From coast to coast, bells across the U.S. rang out 39 times today to honor the life of Rev. Martin Luther King, Jr. ",Apr 05,981719010118193157,28785486,227,858,13926302,0.4939,0.118,0.882,0.0,1609
