,News Account,News Text,News Created Date,News id,News Account id,Retweet Count,Like Count,Followers Count,News Compound,News Positive,News Neutral,News Negative,News Tweets Ago
739,@ABC,"Rep. Billy Long: “What was FaceMash and is it still up and running?”

Facebook CEO Mark Zuckerberg: “No Congressman, FaceMash was a prank website that I launched in college, in my dorm room, before I started Facebook.” ",Apr 11,984211217672736769,28785486,148,423,13926300,0.128,0.041,0.959,0.0,740
740,@ABC,"RT @ABCWorldNews: MISSILES ‘WILL BE COMING’: A United States strike on Syria may be imminent, with President Trump warning Russia that miss…",Apr 11,984208588271833088,28785486,110,0,13926300,-0.0258,0.113,0.729,0.158,741
741,@ABC,Former CIA director Mike Pompeo expected to face testy Senate confirmation hearing as he vies to become next secretary of state. ,Apr 11,984207372263526400,28785486,35,86,13926300,0.0,0.0,1.0,0.0,742
742,@ABC,National Weather Service says tornado that touched down yesterday in downtown Fort Lauderdale was 1 of 2 to hit the South Florida city. ,Apr 11,984205453360971776,28785486,370,548,13926300,0.0,0.0,1.0,0.0,743
743,@ABC,Police fatally shoot knife-wielding suspect inside shopping mall. ,Apr 11,984202701436325888,28785486,60,103,13926300,-0.8316,0.0,0.443,0.557,744
744,@ABC,Onlookers were shocked as a cruise ship in Honduras veered off course and smashed into a pier as it was coming in to port. The damage was deemed minor and the ship later set sail for its next port of call. ,Apr 11,984200327359553536,28785486,180,259,13926300,-0.6705,0.0,0.876,0.124,745
745,@ABC,Prosecutors in Southern California say they are reviewing a sexual assault case against Kevin Spacey. ,Apr 11,984198448353333248,28785486,78,137,13926300,-0.5859,0.0,0.798,0.202,746
746,@ABC,"Arizona teachers gather for ""walk-ins"" at approximately 1,000 schools, part of statewide campaign for a 20% raise and more than $1 billion in new education funding. ",Apr 11,984196156828913664,28785486,78,215,13926300,0.0,0.0,1.0,0.0,747
747,@ABC,"Witness recalls telling Bill Cosby, ""Dr. Huxtable, what are you doing to me?"" ",Apr 11,984194428536545286,28785486,30,40,13926300,0.0,0.0,1.0,0.0,748
748,@ABC,It was Paul Ryan who solidified his former swing district into firm GOP territory. His exit could change that. ,Apr 11,984193174611615744,28785486,18,73,13926300,0.0,0.0,1.0,0.0,749
749,@ABC,"Missouri Gov. Eric Greitens: Report on investigation into extramarital affair is part of an ""absurd political witch hunt."" ",Apr 11,984191105980878850,28785486,62,77,13926300,-0.3612,0.0,0.884,0.116,750
750,@ABC,Weather hampers desperate search for German billionaire CEO Karl-Erivan Haub missing in the Alps since Saturday. ,Apr 11,984186607078117376,28785486,37,39,13926300,-0.5423,0.0,0.78,0.22,751
751,@ABC,"U.S., allies ""still assessing the intelligence"" needed to prove Assad regime conducted recent alleged chemical attack in Syria, Defense Sec. James Mattis says. ",Apr 11,984185932315332608,28785486,93,154,13926300,0.128,0.155,0.741,0.104,752
752,@ABC,Europe’s air traffic control agency tells airlines operating over eastern Mediterranean Sea to exercise caution due to possible military action in Syria. ,Apr 11,984183541281034240,28785486,65,66,13926300,0.0,0.0,1.0,0.0,753
753,@ABC,"NEW: In raid on Trump lawyer Michael Cohen, federal agents sought records from deals related to alleged affairs, media organizations and 2016 presidential campaign, sources tell @ABC. ",Apr 11,984180031172771842,28785486,99,209,13926300,0.0,0.0,1.0,0.0,754
754,@ABC,"Jason Aldean returns to Las Vegas for the first time since last October's mass shooting, which he's called ""the worst night of my life."" ",Apr 11,984177309686083584,28785486,50,116,13926300,-0.6249,0.0,0.859,0.141,755
755,@ABC,ANALYSIS: Paul Ryan’s departure signals the ultimate triumph of Trumpism over the Republican Party in which Ryan came of political age. -@rickklein ,Apr 11,984173261754953731,28785486,50,87,13926300,0.7003,0.209,0.791,0.0,756
756,@ABC,Scientists working on NASA’s Juno mission to Jupiter created an infrared animation showing the cyclones and storms on the planet’s polar regions. ,Apr 11,984173166103879680,28785486,88,235,13926300,0.25,0.08,0.92,0.0,757
757,@ABC,"""I feel so alone"": Heartbreaking video shows an incredibly brave 10 year old girl sharing her story about being bullied in an emotional plea to stop bullying. ",Apr 11,984169464475373569,28785486,1024,1831,13926300,-0.7495,0.186,0.505,0.309,758
758,@ABC,"Gorgeous timelapse captures Mexico's Popocatépetl Volcano erupting early Tuesday morning. 

Officials issued an alert to residents in the Puebla area to be cautious of debris and falling fragments. ",Apr 11,984167767950745602,28785486,299,541,13926300,0.6369,0.176,0.739,0.085,759
759,@ABC,"RT @ABCPolitics: .@PressSec: ""We certainly hope that Republicans will continue to remain in the House, especially those that support the pr…",Apr 11,984165568134701059,28785486,78,0,13926300,0.8055,0.315,0.685,0.0,760
760,@ABC,"Asked if Pres. Trump was considering firing or pushing out Deputy AG Rod Rosenstein, Press Sec. Sanders says, ""I don't have any personnel announcements at this front."" ",Apr 11,984164846366150656,28785486,30,45,13926300,-0.34,0.0,0.921,0.079,761
761,@ABC,"Press Sec. Sanders tells @jonkarl that Russia's actions and the special counsel's Russia investigation have both hurt U.S. relations with Russia and are ""bad for America."" ",Apr 11,984163920897236992,28785486,38,50,13926300,-0.6369,0.078,0.723,0.199,762
762,@ABC,"Press Sec. Sanders tells @jonkarl that Pres. Trump is not telegraphing military moves with tweets.

""The president has not laid out a timetable and still leaving a number of other options on the table...a final decision on that front hasn't been made."" ",Apr 11,984162846320676864,28785486,50,61,13926300,0.0772,0.031,0.969,0.0,763
763,@ABC,"Aviation officer fired for dragging passenger off United plane sues former employer, claiming he had not been trained to deal with unruly passengers. ",Apr 11,984161913893478402,28785486,54,73,13926300,-0.2023,0.095,0.782,0.122,764
764,@ABC,"California agrees to deploy 400 National Guard troops “statewide” at Pres. Trump's request. They ""will not be enforcing federal immigration laws,"" Gov. Jerry Brown says.
 
An earlier tweet reported incorrectly the troops would be sent to the U.S.-Mexico border. ",Apr 11,984161462254997506,28785486,67,105,13926300,0.2023,0.044,0.956,0.0,765
765,@ABC,LIVE: White House holds daily press briefing. ,Apr 11,984159686462246913,28785486,54,56,13926300,0.0,0.0,1.0,0.0,766
766,@ABC,"NEW: Yulia Skripal, ex-spy's daughter poisoned in UK nerve agent attack, releases statement through London police following discharge from hospital. ",Apr 11,984157085079425026,28785486,58,84,13926300,-0.743,0.0,0.76,0.24,767
767,@ABC,"Teachers in Phoenix, Arizona stage a “walk-in,” walking hand-in-hand to show solidarity in their demand for higher salaries and more education funding. ",Apr 11,984154816778784769,28785486,217,749,13926300,0.1779,0.089,0.85,0.061,768
768,@ABC,"Good news comes in threes! Belgium’s Planckendael Zoo welcomed its third baby elephant this year, boosting its herd to 10 members. ",Apr 11,984149296248508416,28785486,391,2055,13926300,0.7901,0.286,0.714,0.0,769
769,@ABC,"RT @ABCPolitics: Ezra Cohen-Watnick, former White House official involved in ""unmasking"" controversy, joining Justice Department. ",Apr 11,984149013841743878,28785486,188,0,13926300,0.5267,0.185,0.815,0.0,770
770,@ABC,"NEW: Putin, Netanyahu spoke by phone today, their offices say. 

Putin ""underlined the fundamental importance of observing Syria's sovereignty,” Russian readout says; Israeli readout says Netanyahu ""reiterated that Israel would not allow for Iranian military buildup in Syria.”",Apr 11,984144842732331008,28785486,200,286,13926300,0.2105,0.062,0.896,0.041,771
771,@ABC,Motive sought after dog-walking resident discovers dismembered body in Brooklyn park. ,Apr 11,984144837040574464,28785486,22,38,13926300,0.0,0.0,1.0,0.0,772
772,@ABC,"“This is an ongoing arms race"": Major moments from Mark Zuckerberg's congressional testimony: ",Apr 11,984140299218890753,28785486,19,53,13926300,0.0,0.0,1.0,0.0,773
773,@ABC,"Your daily dose of inspiration: The Girl Scouts of Troop 6000, the first homeless shelter-based troop in New York City, hope to sell 6,000 boxes of cookies during their first-ever cookie sale. ",Apr 11,984136672785915906,28785486,254,763,13926300,0.743,0.164,0.836,0.0,774
774,@ABC,"M.A., woman who sued ",Apr 11,984135331183292419,28785486,5052,11696,13926300,-0.4019,0.0,0.881,0.119,775
775,@ABC,"Lawmaker pressures Mark Zuckerberg to improve diversity at Facebook. ""This does not represent America...we can do better than that, Mr. Zuckerberg."" ",Apr 11,984131001097089031,28785486,68,152,13926300,0.5423,0.206,0.712,0.082,776
776,@ABC,"Ridge, a student with autism, gives an electrifying performance of the Star Spangled Banner at his high school pep rally. Can you believe it was his first public performance? ",Apr 11,984130350178762752,28785486,337,1281,13926300,0.0,0.0,1.0,0.0,777
777,@ABC,Mark Zuckerberg says Facebook has a 200-member counterterrorism team. ,Apr 11,984130166615040000,28785486,37,76,13926300,0.0,0.0,1.0,0.0,778
778,@ABC,How to tell if your Facebook data was compromised by Cambridge Analytica: ,Apr 11,984125403559325706,28785486,74,82,13926300,0.0,0.0,1.0,0.0,779
779,@ABC,NEW: NRA discloses additional contributions from Russian donors. ,Apr 11,984119776833343497,28785486,139,138,13926300,0.0,0.0,1.0,0.0,780
780,@ABC,"Saudi forces say their air defense systems intercepted ballistic missile fired by Yemen's Shiite rebels and directed at the kingdom's capital, Riyadh. ",Apr 11,984119643513253888,28785486,55,79,13926300,-0.5994,0.056,0.743,0.201,781
781,@ABC,"""I feel so alone"": Heartbreaking video shows an incredibly brave 10 year old girl sharing her story about being bullied in an emotional plea to stop bullying. ",Apr 11,984116669722365955,28785486,1759,3120,13926300,-0.7495,0.186,0.505,0.309,782
782,@ABC,"Paul Ryan's retirement announcement ""a big indicator that the speaker doesn’t think he’d be speaker anymore,” Chris Christie tells @ABC.

“If you’re a betting person, you’re betting on the Democrats for the House in the fall.” ",Apr 11,984111571642339328,28785486,181,458,13926300,0.0,0.0,1.0,0.0,783
783,@ABC,"NEW: Dr Alexander Tayler steps down as acting CEO of Cambridge Analytica to resume former role, board announces. Tayler took over the role after CEO Alexander Nix was suspended amid data privacy scandal. ",Apr 11,984110769720774656,28785486,42,42,13926300,-0.7184,0.0,0.842,0.158,784
784,@ABC,"RECORD BREAKER: This incredible supercentenarian was just certified as the world's oldest living man. 

He was born before Albert Einstein even published his theory of special relativity. ",Apr 11,984110518741946368,28785486,169,468,13926300,0.4019,0.088,0.912,0.0,785
785,@ABC,"Three are dead, more than 100 experience severe bleeding after using synthetic pot in central Illinois and Chicago area. ",Apr 11,984105470544809991,28785486,88,69,13926300,-0.7845,0.0,0.734,0.266,786
786,@ABC,"Defense Sec. Mattis says U.S., allies ""still assessing the intelligence"" on suspected chemical attack in Syria.

""We stand ready to supply military options, if they're appropriate, as the president determines."" ",Apr 11,984099890086236161,28785486,86,129,13926300,0.2732,0.182,0.691,0.128,787
787,@ABC,LIVE: Mark Zuckerberg continues congressional testimony amid Cambridge Analytica data privacy scandal: ,Apr 11,984098989606952960,28785486,51,64,13926300,-0.4404,0.0,0.805,0.195,788
788,@ABC,"NEW: Vice Pres. Mike Pence: ""As Speaker of the House, Paul Ryan was instrumental in enacting President Trump’s agenda and we will be always be grateful for his partnership and support."" ",Apr 11,984098069452148737,28785486,22,30,13926300,0.4588,0.086,0.914,0.0,789
789,@ABC,"""No more snow!"" This Pikachu is letting the world know how it really feels about winter weather. ",Apr 11,984090483776524289,28785486,96,282,13926300,-0.3595,0.0,0.878,0.122,790
790,@ABC,"Michigan State University discouraged student from reporting alleged rape by athletes, lawsuit claims. ",Apr 11,984090470216294402,28785486,75,79,13926300,-0.8519,0.0,0.563,0.437,791
791,@ABC,"""Was President Trump obstructing justice?”

Former FBI Director James @Comey sits down with @ABC's @GStephanopoulos for an exclusive interview airing Sunday night at 10/9c on ABC. ",Apr 11,984086601407123456,28785486,739,1727,13926300,0.128,0.051,0.949,0.0,792
792,@ABC,"Does Facebook plan to sue Alexander Kogan, Cambridge University, or Cambridge Analytica? Facebook CEO Zuckerberg: ""It's something that we're looking into. We already took action by banning him from the platform."" ",Apr 11,984086208694304768,28785486,52,106,13926300,0.0,0.0,1.0,0.0,793
793,@ABC,"Speaker Paul Ryan tells @marykbruce chance of Democrats retaking House in 2018 midterms did not factor into retirement decision.

""My kids aren't getting any younger, and if I stay, they're only going to know me as a weekend dad, and that's just something I consciously can't do."" ",Apr 11,984085766820200448,28785486,44,117,13926300,0.25,0.043,0.957,0.0,794
794,@ABC,"After Utah passed country's first law legalizing so-called free-range parenting, groups in states from New York to Texas are pushing for similar steps. ",Apr 11,984085179546337280,28785486,21,45,13926300,0.0,0.0,1.0,0.0,795
795,@ABC,"NEW: Mitt Romney: ""Love of country compelled Paul Ryan to accept the Speakership, a role he alone could fill at a critical time.

""The country will miss Speaker Ryan."" ",Apr 11,984083421646422017,28785486,19,57,13926300,0.4767,0.217,0.623,0.16,796
796,@ABC,"Mark Zuckerberg says he is not aware of incidences of mishandling of data that have not been disclosed, but adds Facebook is continuing to investigate ""every app that had a large of amount of access to data in the past."" ",Apr 11,984082936537337857,28785486,37,59,13926300,0.0,0.0,1.0,0.0,797
797,@ABC,"NEW: Facebook CEO Mark Zuckerberg says his personal data was included in data sold to ""malicious third parties."" ",Apr 11,984082260981723136,28785486,77,107,13926300,0.0,0.0,1.0,0.0,798
798,@ABC,"NEW: Sen. John Kennedy requests classified briefing on suspected chemical weapons attack in Douma, Syria. 

""We can’t let this go unanswered. If we do, our friends won’t trust us and our enemies won’t respect us.” ",Apr 11,984081133817212928,28785486,61,81,13926300,-0.1531,0.188,0.593,0.219,799
799,@ABC,"Rep. Pallone asks that steps be taken to pass legislation on tech companies in wake of Cambridge Analytica privacy scandal: ""It's time for this committee, and this congress, to pass comprehensive legislation to prevent incidents like this in the future."" ",Apr 11,984080988614504448,28785486,66,100,13926300,0.1779,0.12,0.817,0.062,800
800,@ABC,"Mark Zuckerberg on the difference between Facebook's service and surveillance: ""On Facebook, you have control over your information... I know of no surveillance organization that gives people the option to delete the data that they have, or even know what they're collecting."" ",Apr 11,984080517128585216,28785486,63,104,13926301,-0.296,0.0,0.949,0.051,801
801,@ABC,"Speaker Paul Ryan doesn't think his retirement will hurt GOP's chances in 2018 midterms.

""I really don't think a person's race for Congress is going to hinge on whether Paul Ryan's speaker or not.""  ",Apr 11,984078066560331776,28785486,44,86,13926301,-0.3818,0.047,0.864,0.089,802
802,@ABC,"NEW: Rep. Dennis Ross announces he will not seek re-election, the second GOP retirement announcement today. ",Apr 11,984077323480813569,28785486,196,350,13926301,0.0,0.0,1.0,0.0,803
803,@ABC,"Speaker Paul Ryan: ""I have every confidence that I'll be handing this gavel on to the next Republican speaker of the House next year."" ",Apr 11,984076151399243777,28785486,19,28,13926301,0.5106,0.117,0.883,0.0,804
804,@ABC,"RT @ABCPolitics: .@SpeakerRyan: ""I want to be clear: I'm not done yet. I intend to run through the tape."" ",Apr 11,984075896247193601,28785486,19,0,13926301,0.4404,0.178,0.822,0.0,805
805,@ABC,Actor Tracy Morgan is joined by Martin Lawrence and Jordan Peele as he's honored with a star on the Hollywood Walk of Fame. ,Apr 11,984075405840830465,28785486,305,1347,13926301,0.7717,0.233,0.767,0.0,806
806,@ABC,"Speaker Paul Ryan: ""If I am here for one more term, my kids will only have ever known me as a weekend dad. I just can't let that happen."" ",Apr 11,984075047458373632,28785486,47,105,13926301,0.0,0.0,1.0,0.0,807
807,@ABC,"Speaker Paul Ryan: ""We all know that I did not seek this job. I took it reluctantly. But I have given this job everything I have, and I have no regrets whatsoever for having accepted this responsibility."" ",Apr 11,984074243213180929,28785486,32,81,13926301,-0.4588,0.055,0.785,0.16,808
808,@ABC,"Speaker Paul Ryan: ""This year will be my last one as a member of the House.

""I will be retiring in January, leaving this majority in good hands with what I believe is a very bright future."" ",Apr 11,984074043329413121,28785486,89,239,13926301,0.7264,0.152,0.848,0.0,809
809,@ABC,LIVE: Speaker Paul Ryan holds press conference to announce he will not seek re-election. ,Apr 11,984073187116888066,28785486,41,102,13926301,0.0,0.0,1.0,0.0,810
810,@ABC,RT @GStephanopoulos: Quite a day with Jim @Comey. You'll see it all on Sunday @ABC. ,Apr 11,984069317972066304,28785486,625,0,13926301,0.0,0.0,1.0,0.0,811
811,@ABC,"LIVE: Facebook CEO Mark Zuckerberg appears for second day of congressional questioning. 

He is likely to face more questions about Russian election interference, the Cambridge Analytica data privacy scandal, and more. 

",Apr 11,984069287420792832,28785486,66,82,13926301,-0.5106,0.0,0.878,0.122,812
812,@ABC,"JUST IN: Pres. Trump on Speaker Paul Ryan's retirement announcement: Ryan ""will leave a legacy of achievement that nobody can question. We are with you Paul!"" ",Apr 11,984066703704412161,28785486,64,157,13926301,-0.126,0.0,0.946,0.054,813
813,@ABC,Facebook CEO Mark Zuckerberg returns to Capitol Hill for a second day of congressional hearings as the company grapples with fallout from the Cambridge Analytica data privacy scandal. ,Apr 11,984064991769874432,28785486,31,63,13926301,-0.4404,0.0,0.906,0.094,814
814,@ABC,"Gorgeous timelapse captures Mexico's Popocatépetl Volcano erupting early Tuesday morning. 

Officials issued an alert to residents in the Puebla area to be cautious of debris and falling fragments. ",Apr 11,984063636363673600,28785486,360,728,13926301,0.6369,0.176,0.739,0.085,815
815,@ABC,"@ABCPolitics NEW: DCCC on Speaker Ryan's retirement announcement:

“Stay tuned for more retirements as Republicans increasingly realize that their midterm prospects are doomed.” ",Apr 11,984061364179210242,28785486,7,10,13926301,0.296,0.084,0.916,0.0,816
816,@ABC,"Pastor at church attended by 25,000 steps down amid misconduct allegations. ",Apr 11,984061059047809024,28785486,43,64,13926301,0.0,0.0,1.0,0.0,817
817,@ABC,"@ABCPolitics NEW: Sen. Chuck Schumer responds:

“With his newfound political freedom, I hope the Speaker uses his remaining time in Congress to break free from the hard-right factions of his caucus that have kept Congress from getting real things done."" ",Apr 11,984060361216315392,28785486,8,17,13926301,0.886,0.215,0.785,0.0,818
818,@ABC,"RT @ABCPolitics: @ABC MORE: Speaker Ryan ""will serve out his full term, run through the tape, and then retire in January,"" his office says.…",Apr 11,984060160657289219,28785486,29,0,13926301,0.0,0.0,1.0,0.0,819
819,@ABC,WATCH: ABC News Special Report: Speaker Paul Ryan has told House Republicans he won't seek re-election and plans to leave Congress at the end of his term. ,Apr 11,984056957588783104,28785486,135,322,13926301,0.3612,0.087,0.874,0.039,820
820,@ABC,Video shows thick smoke rising from scene of Algerian military plane crash that killed at least 257 people. ,Apr 11,984056169269530624,28785486,75,79,13926301,-0.802,0.0,0.714,0.286,821
821,@ABC,BREAKING: Speaker Paul Ryan has told House Republicans he won't seek re-election and plans to leave Congress at the end of his term. ,Apr 11,984056042186305537,28785486,115,250,13926301,-0.0516,0.0,0.952,0.048,822
822,@ABC,ABC NEWS SPECIAL REPORT: Speaker Paul Ryan to announce he will not seek re-election. ,Apr 11,984055352458121216,28785486,222,737,13926301,0.5319,0.197,0.803,0.0,823
823,@ABC,"RT @KyraPhillips: NEW - Just spoke to Michael Cohen again - asked him if he still represents President Trump.  His response: ""Why would you…",Apr 11,984053020622249984,28785486,77,0,13926301,0.0,0.0,1.0,0.0,824
824,@ABC,"Three are dead, more than 107 experience severe bleeding after using synthetic pot in central Illinois and Chicago area. ",Apr 11,984050964201115648,28785486,85,72,13926301,-0.7845,0.0,0.734,0.266,825
825,@ABC,"MORE: Speaker of Russia’s parliament says the “whole world is horrified by” Pres. Trump’s tweeting.
 
“The president is sitting there on Twitter taking such decisions that whole world are horrified by. It is not our way,” Vladislav Volodin said. ",Apr 11,984048893318062081,28785486,116,198,13926301,-0.7906,0.0,0.844,0.156,826
826,@ABC,"LATEST: Syrian government calls US threats to attack ""reckless,"" saying they endanger international peace and security. ",Apr 11,984047979295379456,28785486,77,124,13926301,-0.0,0.238,0.524,0.238,827
827,@ABC,"The ""smart"" missiles that Pres. Trump has promised to send to Syria will destroy evidence of a suspected chemical weapons attack, Russia's Foreign Ministry says. ",Apr 11,984047190791409664,28785486,63,74,13926301,-0.836,0.072,0.602,0.327,828
828,@ABC,"Two US officials say there are no US airstrikes underway related to the chemical weapons attack in Syria in response to question about Pres.Trump’s tweet this morning, @LMartinezABC reports. ",Apr 11,984044673332326405,28785486,148,160,13926301,-0.802,0.0,0.767,0.233,829
829,@ABC,"NEW THIS MORNING: Pres. Trump appears to fire warning shot at Russia, saying that the country should ""get ready"" for missiles fired at Syria. ",Apr 11,984042409842454528,28785486,89,179,13926301,-0.7096,0.076,0.669,0.255,830
830,@ABC,DAYLIGHT ROBBERY: Hungry panda goes from cute and cuddly to mischievous snack thief as it steals a friend's lunch from right under their nose. ,Apr 11,984042215805726720,28785486,211,740,13926301,-0.5719,0.095,0.694,0.211,831
831,@ABC,"Trump's legal team met with Mueller's staff on day FBI raided the home, offices and hotel room of the president's personal attorney. ",Apr 11,984040803352875008,28785486,61,102,13926301,0.128,0.061,0.939,0.0,832
832,@ABC,"RT @GMA: From part-time math tutor, to oldest American rookie in the last 50 years. @tjholmes has the story of an NBA rookie's dream debut:…",Apr 11,984039844031680512,28785486,197,0,13926301,0.25,0.077,0.923,0.0,833
833,@ABC,"NEW: Pres. Trump says US relationship with Russia ""is worse now than it has ever been, and that includes the Cold War."" ",Apr 11,984035347809128448,28785486,94,120,13926301,-0.4767,0.0,0.881,0.119,834
834,@ABC,Senators ask Environmental Protection Agency to explain if EPA chief Scott Pruitt lied in Fox News interview. ,Apr 11,984034348407181312,28785486,47,129,13926301,-0.3818,0.0,0.874,0.126,835
835,@ABC,"MORE: After Russia warns the US against military strikes in Syria, Pres. Trump says missiles ""will be coming."" 

He tweeted: ""You shouldn't be partners with a Gas Killing Animal who kills his people and enjoys it!"" ",Apr 11,984033823347347458,28785486,94,117,13926301,-0.8663,0.068,0.662,0.269,836
836,@ABC,"Former Secretary of State Madeleine Albright tells @TheView that she thinks Donald Trump is the ""most undemocratic president"" in U.S. history. ",Apr 11,984033276393410561,28785486,210,658,13926301,0.0,0.0,1.0,0.0,837
837,@ABC,"RT @GMA: Tensions rise over potential Syria response, new evidence allegedly surfaces. @JamesAALongman has the story: ",Apr 11,984033233355489281,28785486,37,0,13926301,-0.4019,0.0,0.856,0.144,838
838,@ABC,"Press Sec. Sanders tells @jonkarl that Pres. Trump ""certainly believes he has the power"" to fire Robert Mueller. ",Apr 11,984031188120756224,28785486,45,70,13926301,0.0,0.105,0.789,0.105,839
839,@ABC,Marjory Stoneman Douglas' school board says it won't participate in a state program that allows certain staff members to carry firearms. ,Apr 11,984029801311801344,28785486,55,241,13926301,0.2732,0.091,0.909,0.0,840
840,@ABC,"Military plane carrying soldiers crashes soon after takeoff in northern Algeria, killing at least 257 people, the country's defense ministry says. ",Apr 11,984029793334292480,28785486,67,63,13926301,-0.5994,0.056,0.781,0.164,841
841,@ABC,"RT @GMA: President Trump lashes out over FBI raid, likely not going to sit down with Mueller. @CeciliaVega has story, @danabrams on legal f…",Apr 11,984027471946362881,28785486,37,0,13926301,0.128,0.061,0.939,0.0,842
842,@ABC,House Oversight Committee Chairman Trey Gowdy dispatches staff to EPA to review Scott Pruitt's travel records. ,Apr 11,984025802340798464,28785486,76,226,13926301,0.0,0.0,1.0,0.0,843
843,@ABC,"JUST IN: Pres. Trump tweets ""Get ready Russia"" and says missiles ""will be coming"" to Syria. ",Apr 11,984024802146045952,28785486,208,276,13926301,0.3612,0.128,0.872,0.0,844
844,@ABC,"AP photo of Mark Zuckerberg's notes shows he was prepared for senators to ask about resigning.

""I made mistakes,"" the note said, under a bullet point labeled ""Resign?"" ""Big challenge, but we've solved problems before, going to solve this one."" ",Apr 11,984022761810153472,28785486,42,57,13926301,0.1154,0.157,0.738,0.105,845
